,Abstract,Journal,Title
261,agricultural expansion and intensification are major threats to global biodiversity ecological functions and ecosystem services the rapid expansion of oil palm in forested tropical landscapes is of particular concern given their high biodiversity identifying management approaches that maintain native species and associated ecological processes within oil palm plantations is therefore a priority riparian reserves are strips of forest retained alongside rivers in cultivated areas primarily for their positive hydrological impact however they can also support a range of forest dependent species or ecosystem services we surveyed communities of dung beetles and measured dung removal activity in an oil palm dominated landscape in sabah malaysian borneo the species richness diversity and functional group richness of dung beetles in riparian reserves were significantly higher than in oil palm but lower than in adjacent logged forests the community composition of the riparian reserves was more similar to logged forest than oil palm despite the pronounced differences in biodiversity we did not find significant differences in dung removal rates among land uses we also found no evidence that riparian reserves enhance dung removal rates within surrounding oil palm these results contrast previous studies showing positive relationships between dung beetle species richness and dung removal in tropical forests we found weak but significant positive relationships between riparian reserve width and dung beetle diversity and between reserve vegetation complexity and dung beetle abundance suggesting that these features may increase the conservation value of riparian reserves synthesis and applications the similarity between riparian reserves and logged forest demonstrates that retaining riparian reserves increases biodiversity within oil palm landscapes however the lack of correlation between dung beetle community characteristics and dung removal highlights the need for further research into spatial variation in biodiversity–ecosystem function relationships and how the results of such studies are affected by methodological choices,Ecology and Evolution,do riparian reserves support dung beetle biodiversity and ecosystem services in oil palm dominated tropical landscapes
262,to understand the long term impacts of forestry i e the conversion of old growth native forests to second growth native forests or conifer plantations on ant species richness i e the number of species and species composition ant assemblages from five old growth forests more than years four second growth forests  years and three conifer plantations  years were compared in the shimanto river basin shikoku southwest japan the number of ant species collected totaled the number of ant species from the old growth native forests second growth native forests and conifer plantations was   and  respectively the overall ant species richness had not been affected by forest conversion however correspondence analysis ca showed that the ant species composition was markedly different between old growth forests and converted forests second growth forests and conifer plantations the species richness of woodland specialists was greater in the old growth forests and open habitat specialists and habitat generalists dominated the converted forests the impacts of forestry on ant assemblages were of a long duration ant assemblages of the second growth forests under regeneration for  years after logging were still distinct from those of old growth forests careful management of second growth forests bordering old growth remnants would be essential to prevent the invasion of open habitat species of ants into the interior of old growth forests,Forest Ecology & Management,impacts of forestry on ant species richness and composition in warm temperate forests of japan
263,agricultural intensification is responsible for the dramatic decline of farmland bird populations in the european union eu the joining of eight central and eastern european cee countries to the eu will re structure agriculture there one of the main threats is the intensification of farmland management can agri environmental programs balance the expected decline in bird assemblages of the cee countries if farming will be intensified we studied this question by comparing bird assemblages of extensively and intensively grazed paired fields in three regions of hungary alkali steppes and meadows in central hungary and alkali steppes in eastern hungary bird assemblages varied significantly across regions and grazing intensity intensively grazed sites showed a higher species number and diversity but lower densities than the extensive sites this is probably the consequence of higher landscape diversity of intensive sites which included farm buildings shelters wells and other structures several bird species mainly with european conservation concern showed contrasting responses to grazing intensity in the three regions including key grassland species black tailed godwit limosa limosa redshank tringa totanus skylark alauda arvensis and corn bunting emberiza calandra therefore threat and sensitivity to grassland characteristics are correlating although many of the declining species ofwestern europe are still abundant in hungarian grasslands our results project the threat of the expected intensification this study showed that it is not possible to provide a general grassland management scheme that will favour all bird species in all regions of hungary in the process of integrating to the eu and re structuring agriculture the establishment of scientifically sound schemes is urgent,"Agriculture, Ecosystems and Environment",effects of grazing intensity on bird assemblages and populations of hungarian grasslands
264,restoration ecologists are increasingly turning to the development of trait filter models which predict how evolved traits limit species membership within assemblages depending on existing abiotic or biotic constraints as a tool to explain how species move from a regional species pool into a restored community two often untested assumptions of these models however are that species traits can reliably predict species broadscale distribution and that the effects of traits on community membership do not vary between restored and remnant habitats the goals of this study were to determine whether combinations of ecological traits predispose moth species toward recolonization of restored prairies and to assess the degree to which restored prairies contain moth assemblages comparable with prairie remnants in we collected moth species from tallgrass prairie remnants and restorations in central iowa principal components analysis pca was used to identify significant combinations of ecological traits that were shared by groups of moth species logistic regression was then employed to test for significant effects of the trait combinations on the frequency of prairie sites occupied by moth species pca partitioned moth traits into four axes that explained a total of of the variance logistic regression detected significant effects for all four pca axes on the fraction of sites occupied by moths species frequently filtered from the regional species pool into prairies were those that had long flight periods and were multivoltine displayed a feeding preference for legumes but not other forb families and were regionally abundant but relatively small in body size ordination revealed significant differences in moth communities among prairies suggesting that species traits and habitat characteristics likely interact to create observed patterns of species recolonization of restorations thus the optimal approach to restoring the lepidopteran fauna of tallgrass prairies may involve locating prairie plantings adjacent to habitat remnants,Ecological Applications,species traits as predictors of lepidopteran composition in restored and remnant tallgrass prairies
265,bird species’ community responses to land use in the suburbanizing twin cities minne sota usa were contrasted among reserves rural lands and suburbs for each land use type bird composition diversity and abundance were recorded for years in  plots in three sampling units each  ha a habitat gradient defined by canopy structure grasslands to savannas to forests was influenced by land use so  plots were used to characterize simultaneous variation in bird communities along land use and habitat gra dients at broad scales aggregate of plots covering  ha suburbs supported the lowest bird richness and diversity and rural landscapes the most with reserves slightly below rural although reserves were like rural lands in diversity of bird communities they supported more species of conservation concern particularly of grasslands and savannas differences among land use types varied with habitat structure suburbs rural lands and reserves had similar forest bird communities but differed in grassland and savanna bird communities the extensive rural forests are important for the region’s forest birds subur ban grasslands and savannas had low shrub abundance low native bird richness and high non native bird richness and abundance however total bird richness and diversity were as high in suburban as in rural and reserve plots because high native richness in suburban for ests and high non native species richness in suburban grasslands and savannas compen sated for lower native richness in suburban grasslands and savannas bird conservation here and in the midwest usa should protect rural forests expand grasslands and savannas in reserves and improve habitat quality overall,Biological Conservation,land use and habitat gradients determine bird community diversity and abundance in suburban rural and reserve landscapes of minnesota usa
266,many snake species are declining globally yet data unavailability in temperate grasslands hinders snake conservation in one of the worlds most endangered biomes to encourage and inform the conservation of snakes in these regions i examined snake species diversity and abundance during years of a mark recapture study at sites located in six american tallgrass prairie preserves in northern illinois usa i emphasized landscape scale relation ships after accounting for covariance with environmental factors at both finer microhab itat and broader regional scales a total of snakes representing seven species was captured using drift fence arrays associated with funnel traps and sheet metal cover the low numbers and diversity of snakes captured when compared to historic evidence indicate that since the s midwestern snake populations have declined non metric multidimensional scaling and mantel tests demonstrate that differences in snake species composition in remnant and degraded prairies are discernable along gradients of urban and agricultural land cover however different patterns of abundance for individual snake species indicate that the relative importance of specific landscape factors differ among spe cies which has significant conservation implications here i recommend that conserva tionists use a species specific approach to manage snake populations i also stress the need for thorough inventory of snake populations and studies of snakehabitat relation ships to advance our understanding of snake ecology and conservation within the little studied temperate grassland habitats of south america and eastern eurasia,Biological Conservation,snake species distributions and temperate grasslands a case study from the american tallgrass prairie
267,forest plantations of exotic conifers represent an important economic activity in nw patagonia argentina however there is a remarkable lack of information on the impact of forestry on native biodiversity we analyzed the effect of pinus ponderosa plantations on bird communities considering different stand management practices dense and sparse tree covers and different landscape contexts where they are planted austrocedrus chilensis forest and steppe ultimately we wished to assess in which way plantations may be designed and managed to improve biodiversity conservation bird richness and abundance did not change significantly in the steppe although community composition did and was partially replaced by a new community similar to that of ecotonal forests in contrast in the a chilensis forest areas species richness decreased in dense plantations but bird community composition remained relatively constant when replacing the native forest with pine plantations also in a chilensis forest stand man agement practices aiming at maintaining low tree densities permit the presence of many bird species from the original habitat in the steppe area in turn both dense and sparse plantations are unsuitable for most steppe species thus it is necessary to manage them at higher scales maintaining the connectivity of the native matrix to prevent the fragmen tation of bird populations we conclude that pine plantations can provide habitat for a substantial number of native bird species and this feature varies both with management practices and with the landscape context of areas where afforestation occurs,Biodiversity and Conservation,bird assemblages in pine plantations replacing native ecosystems in nw patagonia
268,urbanization has been cited as an important factor in worldwide amphibian declines and although recent work has illustrated the important influence of broad scale ecological patterns and processes on amphibian populations little is known about the factors structuring amphibian communities in urban landscapes we therefore examined amphibian community responses to wetland habitat availability and landscape characteristics along an urbanrural gradient in central iowa usa a region experiencing rapid suburban growth we conducted call surveys at wetlands to estimate anuran calling activity and quantified wetland habitat structure and landscape context we used canonical correspondence analysis cca to examine patterns in anuran community structure and identify the most important variables associated with those patterns urban density at the landscape scale had a significant negative influence on overall anuran abundance and diversity while every species exhibited a decrease in abundance with increasing urban density this pattern was especially pronounced for species requiring post breeding upland habitats anurans most affected by urbanization were those associated with short hydroperiods early breeding activity and substantial upland habitat use we suggest that broad scale landscape fragmentation is an important factor underlying anuran community structure in this region possibly due to limitations on the accessibility of otherwise suitable habitat in fragmented urban landscapes this study underscores the importance of a regional approach to amphibian conservation in urban and urbanizing areas in fragmented landscapes a network of interconnected wetland and upland habitats may be more likely to support a successful diverse anuran community than will isolated sites,Ecological Applications,habitat and landscape characteristics underlying anuran community structure along an urban rural gradient
269,remaining patches of semi natural grasslands are hot spots for biodiversity in modern agricultural landscapes in sweden semi natural pastures cover approximately ha however power line corridors road verges and clear cuts cover larger areas in total about ha and these open less intensively managed habitats are potentially important for species associated with taller vegetation and flower resources e g pollinating insects the aim of the present study was to evaluate the relative importance of semi natural pastures and the other three open habitats for butterflies in forest farmland mosaic landscapes in south central sweden species composition differed significantly between habitats in multivariate analyses power line corridors and semi natural pastures harbored several species that were disproportionally abundant in these habitats and species respectively and power line corridors also harbored several species that were classified as typical in indicator species analyses there were more butterfly species higher abundances and a tendency for more individuals of red listed species in power line corridors than in the other three habitats effects of the surrounding landscape composition seemed to be weaker than that of the local habitat however species composition was significantly associated with landscape composition and species with intermediate and low mobility were more abundant in forested landscapes than in landscapes dominated by arable fields analyses of flying time and host plants for larvae suggest that early flying species and species associated with dwarf shrubs were more common in power line corridors than in the other habitats a landscape perspective which takes several habitats into account is needed for conservation of butterfly communities in forest farmland landscapes power line corridors and road verges offer possibilities for creating habitats that are suitable for pollinating insects through conservation oriented management,Biological Conservation,butterfly distribution and abundance is affected by variation in the swedish forest farmland landscape
270,the herbaceous understory forms the richest stratum in temperate broadleaved forests in terms of plant diversity understanding the process of understory succession is thus of critical importance for the devel opment of management guidelines for biodiversity restoration in post agricultural plantation forests we studied effects of stand age forest fragmentation and soil and canopy conditions on species rich ness and abundance of four species groups in the understory of post arable oak plantations in southern sweden herbaceous forest specialists habitat generalists and open land species and woody species the group of forest specialists may approach the richness of continuously forested sites after  years in non fragmented plantations but many forest species were sensitive to habitat fragmentation open land species richness decreased during succession while the richness of woody species and of gen eralists remained stable and was not affected by fragmentation abundance of generalists gradually decreased in non fragmented plantations probably due to competition from colonizing forest specialists soil ph in post arable stands remained consistently higher than in continuously forested stands which maintained differences in species composition the development of a shrub layer seemed to imply a com petitive advantage for forest specialists compared to generalist species for successful recovery of a rich understory we suggest that post arable plantations should be estab lished on loamy soils of intermediate to high ph proximate to older forest with source populations and that a continuous overstory canopy cover of  is maintained by regular light thinnings and promo tion of a shrub layer,Forest Ecology & Management,understory succession in post agricultural oak forests habitat fragmentation affects forest specialists and generalists differently
271,agriculture intensification has drastically altered farmland mosaics while semi natural grasslands have been considerably reduced and fragmented bird declines in northern temperate latitudes are attributed to habitat loss and degradation in farmed landscapes conversely landscape modification effects on grassland farmland bird communities are less studied in the south american temperate grasslands weinvestigated how bird communities were influenced by landscape characteristics in the rolling pampa argentina we sampled bird communities in landscapes of km radius that varied in cover and configuration of pastureland flooding grassland and cropland using generalized linear models we explored the relationship between both bird species richness and abundance and landscape structure analyses were carried out for all species and open habitat grassland and aquatic species pasture area was far the most important factor followed by landscape composition in predicting species richness and abundance irrespective of specific habitat preferences followed by partially flooded grassland cover and its mean shape index grassland frag mentation did not affect species richness or abundance when comparing the effects of landscape variables on bird richness and abundance using mean model coefficients pasture and grassland area effects were on average more than four times greater than those of compositional heterogeneity and about ten times greater than shape effects to conserve species rich bird communities persisting in rolling pampa farmland we recommend the preservation of pasture and grassland habitats irrespective of their fragmentation level in intensively managed farmland mosaics,Biodiversity and Conservation,pasture area and landscape heterogeneity are key determinants of bird diversity in intensively managed farmland
272,species richness abundance and composition of epigeous macro fungi were monitored at grids across four jarrah eucalyptus marginata forest ecosystems in south west western australia as part of an integrated monitoring project to examine responses to different timber harvesting and regeneration treatments forest that had never been harvested or had not been harvested for over years was used as a reference and compared to forest that had undergone shelterwood selective cutting and gap release treatment after silvicultural treatment also included post harvest burning all epigeous species of macrofungi and their abundance were recorded from autumn surveys at each grid a total of species were recorded overall mean species richness and abundance was similar but the composition of species assemblages contributing to macrofungal communities differed significantly between silvicultural treatments and reference forest sixty nine species were restricted to reference forest while were restricted to shelterwood selective cut and to gap release treatment in all treatments the overall mean number of species per grid recorded fruiting on soil was  times higher than that recorded on litter or wood species richness of sporophores recorded on both soil and litter was similar for all treatments but was significantly lower on wood in reference forest compared to the gap release treatment mean sporophore abundance was significantly higher on litter and lower on wood in reference forest compared with silviculturally treated forest because fire is an integral part of jarrah forest silviculture it was not possible to separate the singular effect that either tree removal or fire had on macrofungal communities however in different time since treatment classes the overall composition of species assemblages was different but species richness and abundance for each silvicultural treatment were similar each forest ecosystem supported its own unique fungal community which supports the concept of ecosystems in jarrah forest based on forest structure and understory vegetation resulting from variation in climate soils and landforms current conservation policy and silviculture practice in jarrah forest produces a landscape mosaic containing early succession stands through to mature forest across the landscape which is important for the maintenance of fungal biodiversity much of the fungal population in jarrah forest however remains unknown and only a long term commitment to survey and monitoring will improve knowledge on the diversity and ecology of these important organisms and ensure their consideration in future management decisions,Australian Forestry,forestcheck the response of epigeous macrofungi to silviculture in jarrah eucalyptus marginata forest
273,higher diptera schizophora are taxonomically and ecologically diverse and include bog specialist and bog associated species known to respond to peatland disturbance we examined the effects of three factors habitat size vegetation cover and surrounding land use measured in concentric circles of and m radii from the sampling location on schizophora species richness diversity and composition in six temper ate eastern nearctic bogs a total of species of schizophora were collected with observed species richness among sites ranging from to assemblages in apparently similar peatlands were highly variable but characterized by a few highly dominant species most of which are not peatland specialists bog size had no influence on species richness or diversity vegetation cover at the sampling sites and surrounding land use at the largest scales measured and m both influenced species assemblages,Wetlands,effects of habitat size vegetation cover and surrounding land use on diptera diversity in temperate nearctic bogs
