,Abstract,Journal,Title
400,walnut fruit forests represent both a valuable hotspot of biological diversity and have significant economic value for the livelihoods of local communities however the sustainable management of these forests is a complex task requiring the successful juggling of the different interests of local stakeholders including fulfilling their economic social and ecological demands birds were chosen as the indicator of biodiversity with which to evaluate the effects of forest management activities a research study was conducted in during the birds breeding season in five different habitats primary and secondary forests plantation agroforestry and brushwood using the point sampling method a total of species were recorded according to the various diversity indices employed the best habitats for species richness were areas of agroforestry while primary forests were found to be the best habitats in terms of species abundance in contrast the lowest bird diversity was observed in plantations due to their structural homogeneity in addition habitat suitability was assessed according to both horizontal and vertical structural parameters and tested using five selected indicator bird species the results reveal a link between birds and vegetation with abundance of old trees availability of deadwood and habitat understorey density found to be the most important indicators of bird survival our research findings highlight that it is imperative to protect existing primary forests which are genetic diversity hotspots for endemic species such as dendrocopos leucopterus although areas under agroforestry were primarily found to be relatively promising habitats in terms of species richness these intensively managed ecosystems may also be useful for simultaneously fulfilling the needs of local people if such projects are carefully planned and managed,Biodiversity,evaluating the effects of habitats on birds in the walnut fruit forests a case study from kyrgyzstan
401,diversity of the genus dolichopus latreille in three different habitats of east azerbaijan province with new records for iran  the present study is a survey of species diversity of the genus dolichopus in east azerbaijan province iran the species were collected using a standard entomological net from three habitats forest grassland and wetland areas in northwest iran in based on the data collected the forest area with the highest diversity indices h species and h species in chichakli and keleybar regions respectively had the most diverse and abundant species followed by grassland and wetland areas the dominant species in the study areas were dolichopus longitarsis and d simplex besides three species d siculus d kiritshenkoi and d plumipes were recorded from iran for the first time diagnostic characters and geographical distribution of the species occurring in the studied areas with supplementary figures are provided,Arxius de Miscel·lània Zoològica,diversity of the genus dolichopus latreille in three different habitats of east azerbaijan province with new records for iran
402,agro ecosystem biodiversity is threatened by increasing spatial homogenisation of intensively managed farmland yet current understanding of patterns of arable plant diversity at various scales remains limited we evaluated the extent to which species richness of arable plants in the rolling pampas of argentina is determined by field position fencerow edge and centre and crop type at both field local and landscape scales plant richness was assessed in maize soybean and wheatsoybean fields across four landscape types differing in spatial complexity as defined by percentage area devoted to cropland species richness was hierarchically nested within landscape types field positions and crop types landscape richness  diversity the cumulative number of species in a set of fields was additively partitioned into two components one for local richness ² diversity the mean number of species per field and one denoting differences in species composition among fields ¡ diversity where ¡  ² field position was the main determinant of landscape scale plant richness overall  diversity declined from fencerows through field edges to field centres but was unaffected by crop type spatial variation in species composition ¡ diversity rather than species packing within fields ² diversity accounted for most of the variation in arable  diversity higher ¡ diversity in field edges than in field centres suggested that propagule dispersal from fencerow vegetation may create a mass effect onto certain crop types shifts in  diversity of major perennial life forms chamaeophytes and phanerophytes between field positions and crop types reflected the contrasting disturbance regimes affecting plant communities of fencerows and cultivated fields our results indicate that preserving coherent and extensive fencerow networks is essential to conserve farmland biodiversity moreover maintaining landscape heterogeneity to support elevated ¡ diversities of arable plants requires cropping systems that promote crop diversity in both space and time,"Agriculture, Ecosystems and Environment",the arable plant diversity of intensively managed farmland effects of field position and crop type at local and landscape scales
403,urban densification in the uk is leading to the fragmentation and isolation of natural habitats in our cities current research investigating bee assemblage distribution along urban rural gradients struggles to gain synthesis as sites cities and regions studied vary between studies since bees use a variety of areas for their nesting and foraging resources over the urban rural gradient increasing study of the types of sites sampled provides a firmer understanding of how bee assemblages respond to urbanisation bees were sampled at canal side and parkland sites across birmingham uk with sweep netting and pan trapping undertaken between april september in and april september in abundance and diversity metrics were tested for variation between land use types using anova and rarefaction and applied to mixed models to test for relationships with landscape type m built space and agricultural land within m m km km km km km km and km of each site and local site variables floral availability level of management and exposure i found that in canal sides and parkland overall bee abundance showed a significant positive relationship with built space whilst rarefaction indicated species richness was greater in rural areas furthermore division of abundance metrics between genera and species showed increased abundance in several bumblebee species to greater built space whilst andrena spp showed a negative relationship with built space this chapter presents further evidence that the variation in bee abundance between land use types is species specific supporting recent studies that indicate highly disturbed urban environments filter bee species and determine bee assemblages this chapter also highlights the importance of site type replication within regions as these results contrast with a study of cemeteries and churchyards in the same region underlining the importance of sampling all potential habitat sites along urban rural gradients,Unpublished,an investigation into bee assemblage change along an urban rural gradient
404,different human land uses are not uniform in their ecological effects on remnant faunas explicitly rec ognizing the relative habitat value of prevalent land uses in comparison to forest will help improve con servation theory and practice in human modified landscapes to better understand how common land uses influence habitat quality and buffer forest fragments in tropical landscapes we characterized reptile and amphibian assemblages across forest pasture and forest peach palm palmito ecotones in north eastern costa rica we found that forest remnants contained significantly greater overall richness and abundance of reptiles and amphibians than either palmito or pasture palmito supported greater species richness and abundance of herpetofauna than pastures assemblages of reptiles and amphibians in pal mito also exhibited greater similarity to those found in forests than did assemblages in pasture particu larly for reptiles species exhibited distinctive responses to forest land use ecotones with some species reaching their highest abundances in non forest habitat our results show that two important land uses in costa rica differ in their capacity to buffer forest patches and promote landscape connectivity for rep tile and amphibian populations understanding these differences is crucial for identifying matrix environ ments that can complement the natural forest habitats of sensitive reptile and amphibian species,Biological Conservation,forest land use complementarity modifies community structure of a tropical herpetofauna
405,in many tropical areas of the world pristine forests have become rare nevertheless due to shifts in the human population the area covered by secondary forests is increasing these forests may harbor a rich flora and fauna and are considered to be main refuges for species of primary forests however this issue is far from clear to assess the conservation value of secondary forests in the atlantic forest of brazil we compared the diversity of spiders in differently aged secondary forests with old growth forests within a larger project treating several invertebrate taxa we sampled spiders using a standard protocol in sites of three successional stages    years old and old growth forests years untouched in two nature reserves we describe the diversity and structure of the assemblages using morphospecies and genera and analyze richness at the genus level generic richness and diversity showed no differences between successional stages i e did not increase from the youngest to older forests but guild diversity did increase the youngest stage showed the highest variability in generic composition and the turnover of genera and species was strong between the younger forests  years old and forests older than years high alpha diversity high turnover among sites and the lack of differences in richness between stages support the value of secondary forests for species conservation in the region studied,The Journal of Arachnology,the conservation value of secondary forests in the southern brazilian mata atlantica from a spider perspective
406,tropical forests worldwide are being fragmented at a rapid rate causing a tremendous loss of biodiversity determining the impacts of forest disturbance and fragmentation on tropical biotas is therefore a central goal of conservation biology we focused on bird communities in the interior m from forest edge of forest fragments and ha in the lowlands of papua new guinea and compared them with those in continuous forest we surveyed bird communities using point counts mist netting and random walks and measured habitat and microclimate characteristics at each site we also surveyed leaf dwelling arthropods butterflies and ants and obtained diet samples from birds to examine food availability and food preferences we recorded significantly fewer bird species per point in the ha forest fragment than in other study sites overall we recorded and species respectively in forest fragments and in continuous forest frugivores especially large frugivores and insectivores had lower species richness in forest fragments than continuous forest our results did not support the food scarcity hypothesis that is the decline of insectivorous birds in forest fragments is caused by an impoverished invertebrate prey base we also found no significant differences among forest fragments and continuous forest in microclimates of forest interiors rather we found that microhabitats preferred by sensitive birds i e of species with the strongest preferences for continuous forest were less common in forest fragments  of points than in continuous forest of points our results suggest that changes in microhabitats may make forest fragments unsuitable for sensitive species however limited dispersal capabilities could also make some species of birds less likely to disperse and occupy fragments in addition impoverished food resources size of the forest fragment or hunting pressure could contribute to the absence of large frugivorous birds in forest fragments the forest fragments in our study preserved as village based protected areas were not large enough to sustain the bird communities found in continuous forest however because these fragments still contained numerous bird species preservation of such areas can be an important component of management strategies to conserve rainforests and birds in papua new guinea,Journal of Field Ornithology,effect of forest fragmentation on bird species richness in papua new guinea
407,rangeland degradation has been widespread and severe throughout the syrian steppe as a result of both unfavorable environmental conditions and human induced impacts to explore the effectiveness of management based strategies on establishing sustainable rangeland development we compared the response of temporarily removing grazing from rangelands ecosystems to those under a continuous heavy grazing regime results indicated that ungrazed sites had both higher biomass production and plant species composition than grazed sites ungrazed plots produced more than fourfold herbaceous biomass production than continuously grazed plots p extent of plant cover was greater in ungrazed plots than grazed plots respectively furthermore areas protected from heavy grazing had over greater species composition thus protection from grazing can increase forage production and species composition but may not necessarily improve plant species available for livestock utilization a more balanced grazing management approach is recommended to achieve an optimal condition of biomass production quantity vegetation cover quality and available forage species that contribute to proving livestock grazing conditions,International Journal of Agriculture & Biology,effect of small ruminant grazing on the plant community characteristics of semiarid mediterranean ecosystems
408,grasslands are usually the most suitable environment for butterflies but have been also traditionally used for productive activities this paper compares the impact of mowing and grazing on butterfly biodiversity in two s italian campania grasslands at campo somma cs and pianoro di prada pp located at an identical altitude of m these grasslands have an area of approximately ha each and are at a km distance from each other they share similar climate and are both surrounded by woods mainly of sweet chestnut cs is managed for haying and is mown once a year in june pp is used for sheep and cattle grazing weekly transects were made from april to september in and during the butterfly flight activity we analysed data from eight monthly transects by kruskalwallis and mannwhitney tests we observed butterfly species at pp and at cs diversity indexes were significantly higher at pp whereas evenness was similar the monthly comparisons of species richness showed that except for april pp values were always significantly higher species abundance was significantly higher at pp in june july and august in all months except in april the shannonwiener index was also significantly higher at pp as was simpsons index in may june and september domi nance index differed significantly only in may june and september whereas evenness was never significantly different between the two grasslands these data show that as concerns butterflies the impact of mowing was much stronger than that of grazing,Biodiversity and Conservation,haying and grazing effects on the butterfly communities of two mediterranean area grasslands
409,increased tourist activity and recreational use of wilderness and other protected areas has endangered zones of high environmental value the aim of this work was to evaluate the effects of trampling intensity low high use trails and untrampled trails and distance from the trails on the trails at and m from the trails on the vegetation chemical physical and microbiological properties of a soil in mediterranean mountain areas trail type and distance from the trail significantly influenced several parameters high use trails showed lower values of plant cover and diversity of vegetation species as well as soil respiration and some enzyme activities phosphatase b glucosidase and dehydrogenase than low use trails in addition the effects of trampling spatially extended further from these high use trails than from low use trails statistical analysis showed that some microbiological basal respiration dehydrogenase activity and b glucosidase activity and vegetal parameters plant cover and diversity may be established as a set of indicators for the evaluation of soil quality on these areas subjected to human trampling we concluded that trampling significantly impacts on soil microbial processes and vegetal communities and visitor should be restricted from entering ecologically sensitive areas due to the effects of trampling,Land Degradation & Development,the effects of human trampling on the microbiological properties of soil and vegetation in mediterranean mountain areas
410,a more diverse arbuscular mycorrhiza am fungal community should be more versatile and resilient to variation in environmental conditions over space and time to evaluate the effect of no till and conventional tillage systems am fungal diversity was assessed as part of a long term field experiment by sequencing of dna extracted from soil that encoded the large ribosomal sub unit and was obtained by nested pcr in comparison with no till conventional tillage decreased am fungal diversity by differences between treatments in the frequency of the operational taxonomic units otus present in soil confirm that am fungi are differently vulnerable to soil disturbance,Soil & Tillage Research,impact of tillage system on arbuscular mycorrhiza fungal communities in the soil under mediterranean conditions
411,epiphytic lichens are one of the taxonomic groups most sensitive to forest management nevertheless they have not yet been exhaustively included in the assessment of sustainable forest management this work aimed at evaluating the effects of forest management on epiphytic lichens in coppiced forests exploring the spatial patterns of diversity and the composition of communities moreover the goal was to compare the performance of four potential indicators for monitoring the effects of forest management on epiphytic lichens total lichen diversity species associated with intensive management species associated with aged coppiced woodlands and indicator species ratio isr in humid mediterranean liguria sampling units were chosen in castanea sativa and deciduous quercus spp forests subjected to different forest management practices intensively managed coppice and aged coppice high forest the effect of forest management was evident in terms of species composition since it was possible to find significantly associated species for each of the two management types at each sampling site the four indicators were calculated using indicator value analysis and compared through correspondence analysis the isr was shown to be a more effective indicator being independent of floristic composition and the occurrence of rare species,Plant Biosystems,assessing the effects of forest management on epiphytic lichens in coppiced forests using different indicators
412,the present paper studies butterfly grasshopper and vascular plant communities in ten seasonally flooded grasslands with different anthropogenic disturbance regimes nw greece disturbance intensity was assessed on the basis of disturbance frequency and type grazing mowing trampling constructions the distribution patterns of but terflies are regulated by humidity and elevation redundancy analysis elevation flower heads abundance low distur bance intensity and plant species richness predict grasshopper species richness well while the latter together with humidity predict plant species richness generalized linear models chorthippus lacustris a critically endangered endemic grasshopper species is positively associated with humid microhabitats with high flower heads abundance an indicator value procedure reveals four butterfly species as being typical species for habitats with a pronounced char acter of hedgerows and tree lines conservation management of grassland butterflies should focus on the maintenance of the humid character of the humid grasslands as well as on the maintenance of hedgerows and tree lines the reduction of human induced disturbance towards occasional grazing and mowing seems to benefit both butterfly and grasshopper communities finally we suggest the use of grasshoppers as surrogates for vascular plants and vice versa given their congruent species richness patterns,Journal of Insect Conservation,butterfly and grasshopper diversity patterns in humid mediterranean grasslands the roles of disturbance and environmental factors
413,dung beetles are considered keystone species because of their role in decomposition seed dispersal and control of vertebrate parasites in grazed habitats despite the ecological importance of this group to pasture ecosystem functioning still little is known about its relationship with grazing management activities we evaluated the conservation value of protected areas for dung beetle diversity by comparing two different management conditions of mediterranean savanna in central spain four different sites with wild herbivory red deer roe deer were sampled inside the caban ̃eros national park and four sites with traditional agrosilvopastoral management were sampled in a sheep farm near the park the dung beetle species richness was similar between savanna conditions but the total dung beetle abundance and biomass were considerably greater in the park grasslands than in the grasslands of the sheep farm dung beetle species composition species dominance and abundance by functional groups from both park and farm sites were different despite the high similarity among the sampled sites in both hydric content and dung availability onthophagus maki illiger and o furcatus fabricius were the dominant species in the park while o furcatus aphodius foetidus herbst and caccobius schreberi l were the dominant species on the farm species richness and abundance of telecoprids were higher in the park than on the farm abundance of paracoprids was also higher in the park than on the farm while no differences in species richness and abundance of endocoprids were observed between both conditions these results suggest that management activities such as plowing and the use of veterinary substances affect soil structure and dung quality and could be important factors that alter dung beetle assemblages in terms of composition abundance and biomass on traditional farms,Rangeland Ecology & Management,comparing dung beetle species assemblages between protected areas and adjacent pasturelands in a mediterranean savanna landscape
414,mechanicalmanagementofforestfuelsisincreasinglyusedintheeuro mediterraneanregionin response to the abandonment of traditional agroforestry and the concurrent increase in fire hazard although fuel management may have positive side effects for biodiversity its long term impacts remain largely unknown we used a year post management chronosequence to investigate the influence of time since fuel management and management frequency on bird assemblages in cork oak quercus suber for ests fuel management strongly affected bird species richness abundances and assemblage composi tion with rapid changes often occurring during the first  years followed in the next decades by a slow convergence to pre management levels in winter overall species richness and abundance and that of frugivores and shrub foragers were negatively affected by recent and recurrent management only recovering in stands unmanaged for years in spring insectivore abundance and the richness and abundance of shrub foragers declined immediately following management increased to a maximum about years later and declined thereafter breeding granivores and ground foragers were the only groups that benefitted from fuel management there were no overall effects on species of conservation concern although a few species with unfavourable status benefitted from fuel management synthesis and applications our study confirmed that mechanical fuel management has positive effects on some early successional bird species of conservation concern although its effects were limited these benefits should be compared with the strong negative impacts on key bird species such as wintering frugivores which play a pivotal role in ecosystems by promoting seed dispersal to reconcile the positive and negative aspects fuel management should be used to create heteroge neous mosaics of forest patches encompassing a range of sizes  ha and successional stages of understorey vegetation including stands undisturbed for years this management strategy will likely maintain conditions for a wide range of species with contrasting ecological requirements while also reducing fire hazard,Journal of Applied Ecology,long term responses of mediterranean birds to forest fuel management
