,Abstract,Journal,Title
133,the area covered by eucalyptus plantations is significantly increasing in brazil for economic reasons however the impact of such land use change is still unknown in this study we evaluated the spatial temporal distribution and abundance of terrestrial non volant small mammals on a recently converted landscape whose matrix is formed by eucalyptus plantations up to years of age from august to july we carried out monthly sampling campaigns over a grid of sampling units formed by pitfall traps covering both the landscape matrix of eucalyptus plantations n and legal conservation areas of native vegetation n and abandoned pastures n a total of individuals from species of the orders didelphimorphia spp and rodentia spp were captured however only three species of rodents olygorysomys flavescens oligoryzomys nigripes and calomy tener represented of the total amount eucalyptus plantations had a lower species richness and abundance than the abandoned pasture and the remaining fragments of native vegetation although the present species are predominantly generalists there is clear distinction among environments in terms of their species composition and relative abundance which also present a pronounced time variation the assemblage found in this study suggests that silvicultural landscapes still have some conservation value with species that seem to be resident at the eucalyptus plantations moreover the presence of the native and abandoned pastures patches imbibed in the eucalyptus plantation matrix may increase the carrying capacity of such a silvicultural system and these landscapes may play a role in maintaining local biodiversity,Forest Ecology & Management,terrestrial non volant small mammals in agro silvicultural landscapes of southeastern brazil
134,the composition abundance diversity and species richness of soil macro fauna communities were assessed in four major land use types present within protected and agricultural landscapes in maasai mara savannah ecosystem mme kenya the four land uses were natural grassland woodland inside and outside protected area maize mono cropping and maize bean intercropping systems in adjacent agricultural farms sampling of soil macro fauna was carried out in november short rain april wet rainy season and september dry season hand sorting of soil taken from × × cm monoliths was used to extract all soil macro fauna greater than mm body length a total of individuals comprising of species mainly belonging to phylum arthropoda distributed across classes and orders and phylum annelida with one order were collected across the four different land use systems termites and ants and to a lesser extent coleopteran and earthworms were the most abundant groups significant effects of land use on macro fauna abundance and species richness in all cases p were observed there were significant interaction between season region land use p region land use p and region protection land use p grassland and woodland had the highest density vs individual m of total macro fauna whilst the lowest density occurred in agricultural land individual m agriculture altered macro fauna communities by declining individuals from order coleoptera hymenoptera and isoptera by and eliminating some orders species human related disturbances outside protected area network declined macro fauna density in grassland and woodland in dry region vs but increased the density by vs in wet region the study highlights the important effect of agriculture on macro fauna communities and the need for conservation alternatives in unprotected areas this study supports conservation of biodiversity beyond protected area network,International Journal of Biodiversity and Conservation,land use practices and their implications on soil macro fauna in maasai mara ecosystem
135,an important question for tropical forest restoration is whether degraded lands can be actively managed to attract birds we censused birds and measured vegetation structure at stations in young –‐yr old actively and passively restored pasture and old growth forest at las cruces biological station in southern costa rica during ‐min point counts we detected a high diversity— species— of birds using the restoration area surprisingly species richness and detection frequency did not differ among habitats and proportional similarity of bird assemblages to old growth forest did not differ between restoration treatments bird detection frequency was instead explained by exotic grass cover and understory stem density—vegetation structures that were not strongly impacted by active restoration the similarity of bird assemblages in actively and passively restored forest may be attributed to differential habitat preferences within and among feeding guilds low structural contrast between treatments or the effect of nucleation from actively restored plots into passively restored areas rapid recovery of vegetation in this recently restored site is likely due to its proximity to old growth forest and the lack of barriers to effective seed dispersal previous restoration studies in highly binary environments i e open pasture vs tree plantation have found strong differences in bird abundance and richness our data contradict this trend and suggest that tropical restoration ecologists should carefully consider when the benefits of active restoration outweigh the cost of implementation and which avian guilds should be used to measure restoration success given differential responses to habitat structure,Biotropica,avian habitat preference in tropical forest restoration in southern costa rica
136,aim to analyse how the dung beetles scarabaeinae respond to a modified variegated landscape taking into account the biogeographical peculiarities of the mexican transition zone location this study covers cloud forest cf of the sierra norte de puebla mountain range and part of the sierra madre oriental mountain range mexico methods we applied proportional sampling based on the landscape variegation model with scarabaeinae as the indicator group and using two approaches structural units vegetation type and spatial units windows we used two measures  richness and shannon diversity  and applied multiplicative diversity partitioning to obtain independent alpha and beta diversities for the landscape windows and vegetation types we grouped species by biogeographical distribution pattern for the biogeographical analysis and by whether they were originally from cf results the transformation of cf into secondary forest pastures and other types of vegetation increases the scarabaeinae diversity of the landscape in vegetation types and windows this increase is the result of species arriving from the tropical lowlands however the original dung beetle community of the cf dominates at different scales in the number of species abundance and biomass with increasing habitat modification beta diversity increases in the windows and species with the tropical palaeoamerican distribution pattern increase in abundance in vegetation types and windows main conclusions the variegated character of the landscape explains well the distribution and diversity of this dung beetle community the peculiar characteristics of the mexican transition zone have an effect owing to the overlap of fauna with different biogeographical origins the conversion of fragmented landscapes to variegated landscapes could be a conservation goal in human modified mountain landscapes sampling proportional to the area of different types of vegetation and the use of windows offer an alternative experimental design in variegated landscapes,Diversity and Distributions,how dung beetles respond to a human modified variegated landscape in mexican cloud forest a study of biodiversity integrating ecological and biogeographical perspectives
137,functional diversity an important element of avian biodiversity can be examined by quantifying foraging guild composition understanding the ecological processes that underpin functional diversity of birds in oil palm elaeis guineensis landscapes is important because different foraging guilds are likely to be influenced in different ways by land use practices we surveyed birds at sites within oil palm landscapes and at sites within logged peat swamp forest recording species belonging to foraging guilds oil palm landscapes supported a lower abundance of insectivorous granivorous and omnivorous birds than did logged peat swamp forest despite the latter being severely degraded due to intensive timber extraction however abundances of other groups of foraging birds such as raptors and wetland taxa were higher in oil palm landscapes than logged peat swamp forest frugivorous species were more abundant in smallholdings than plantation estates probably because of the presence of native trees foraging guild diversity was explained by stand level attributes such as stand age vegetation cover epiphyte persistence and canopy cover however each foraging guild exhibited unique responses to different oil palm management regimes and stand level attributes only arboreal omnivores and terrestrial frugivores were affected by the proximity of nearby natural forest this diversity of responses implies that the occurrence of particular avian foraging guilds may not be a suitable ecological indicator of best practice palm oil production our study also suggests that multiple conservation measures will be needed in oil palm landscapes irrespective of management regimes including the maintenance of ground layer vegetation cover the pruning of oil palm canopy to permit light penetration to the ground layer re vegetation of parts of oil palm landscapes with native trees and retention of natural and or secondary forest patches within the boundaries of plantations,Ibis,the influence of agricultural system stand structural complexity and landscape context on foraging birds in oil palm landscapes
138,aim anthropogenic land use change is a major driver of the current extinction crisis but the processes through which it acts on biodiversity are complex and still poorly understood here we use several biodiversity metrics to make a comprehensive assessment of the response of an endemic rich bird assemblage to land use change location sao tome´ island sao tome and prncipe africa methods we sampled bird assemblages in point counts stratified across three regions and four land use types species richness was examined using accumulation curves and generalized linear mixed effect models compositional and structural changes were analysed with ordination techniques we used correlations and model selection to identify species traits and environmental variables associated with such changes results at the point level there was a slight decrease of species richness in more intensive land uses however higher dissimilarities within these land uses led them to have higher overall species richness endemics dominated forest environments and although most preferred less disturbed land uses many persisted across all land uses non endemics were virtually absent from forests but became very abundant in the more intensive land uses canopy cover was the best predictor of the shift between endemic and non endemic species and allowed identifying regional differences in the local responses of bird assemblages to land use change main conclusions to better understand biodiversity it is crucial to use several metrics simultaneously in sao tome´ simply using species richness the single most used biodiversity metric could have been misleading as it concealed major shifts in the bird assemblage structure towards an endemism impoverished avifauna despite scarce data on land use cover we demonstrate how landscape context can be vital to understand biodiversity patterns and that highly forested surroundings might overestimate the strict value of more intensive land uses our results raise concerns about the long term persistence of endemic species restricted to islands where forested land uses are being lost,Diversity and Distributions,biodiversity and land use change understanding the complex responses of an endemic rich bird assemblage
139,agriculturally altered vegetation especially oil palm plantations is rapidly increasing in southeast asia low species diversity is associated with this commodity but data on anuran diversity in oilpalm plantations are lacking we investigated how anuran biological diversity differs between forest and oil palm plantation and whether observed differences in biological diversity of these areas is linked to specific environmental factors we hypothesized that biological diversity is lower in plantations and that plantations support a larger proportion of disturbance tolerant species than forest we compared species richness abundance and community composition between plantation and forest areas and between site types within plantation and forest forest stream vs plantation stream forest riparian vs plantation riparian forest terrestrial vs plantation terrestrial not all measures of biological diversity differed between oil palm plantations and secondary forest sites anuran community composition however differed greatly between forest and plantation and communities of anurans in plantations contained species that prosper in disturbed areas although plantations supported large numbers of breeding anurans we concluded the community consisted of common species that were of little conservation concern commonly found species include fejervarya limnocharis microhyla heymonsi and hylarana erythrea we believe that with a number of management interventions oil palm plantations can provide habitat for species that dwell in secondary forests,Conservation Biology,effects of oil palm plantations on diversity of tropical anurans
140,the tropical dry forest region along the western slope of central america represents a biodiverse and fragile area that is under increasing pressure from agricultural production thus threatening the provision of ecosystem services the integrity of these landscapes and the rural communities who depend on them to address this issue we evaluated the influence of common agricultural management practices cropping and livestock systems vs the quesungual slash and mulch agroforestry system qsmas on diverse parameters of soil quality and function we then used this information to identify soil invertebrate bioindicators that represent key aspects of soil quality chemical fertility physical properties aggregate morphology and biological functioning in february of soil sampling was conducted on six hillside farms near the town of somotillo in western nicaragua to assess soil properties and the abundance and diversity of soil macrofauna within four management systems qsmas based on maize production traditional maize cropping system with few trees tc silvopastoral system with low tree density sp and secondary forest sf used as a reference the conversion of forest to agriculture demonstrated the greatest impact of management in this study for example sf presented significantly higher diversity of soil invertebrate taxonomic groups than either tc or sp p and demonstrated the lowest level of soil compaction significantly less than sp p additionally sf demonstrated the highest value of soil quality according to a synthetic indicator that integrates chemical physical and biological aspects of soil quality although overall soil quality under qsmas was lower than sf this system demonstrated the highest abundance number of individuals of soil macrofauna and appeared to at least partially mitigate the negative consequences of forest conversion on soil functioning using the indicator value index which ranks species according to their specificity and fidelity across sites along with farmer consultation we found seven indicator taxa of soil quality that could greatly facilitate future evaluation of land management impacts by farmers and technicians in the region we suggest that the methodology applied is robust and adaptable to diverse agroecological contexts and would allow for more rapid responses to evolving land use issues as they arise,Ecological Indicators,soil macrofauna as indicators of soil quality and land use impacts in smallholder agroecosystems of western nicaragua
141,depending on the mosaic of habitats that is created forest fragmentation can reduce the abundance and diversity of forest birds temperate deciduous forests in south america are rapidly being replaced by pine plantations causing changes in habitats for both breeding and migrant birds we examined differences in avian species richness and abundance in three areas a reserve with continuous tracts of native forest forest fragments and pine plantations four species were negatively affected by fragmentation with their abundance declining from continuous forest to pine plantations fourteen species were not affected by fragmentation and eight had significantly increased abundance in pine plantations compared to continuous forest overall abundance in pooled and ground understorey birds was higher in forest fragments and pine plantations compared to continuous forest the abundance of granivorous species was higher in the pine plantations than in the forest reserve but the abundance of insectivorous species was higher in the forest reserve and in forest fragments than in pine plantations thus forest fragmentation affects birds differentially according to their feeding ecology,Oryx,avian responses to fragmentation of the maulino forest in central chile
142,in the atlantic forest region there is a need to develop economic activities that can be carried out in buffer zones around parks with minimal impact on forest bird species one such possibility is the farming of yerba mate ilex paraguariensis under native trees we compared bird species presence and abundance between a forest reserve and an adjacent plantation of shadegrown yerba mate to determine which species might use such plantations of the species that were regularly recorded in the forest including five globally threatened species were also regularly recorded in the plantation most canopy species and tree trunk insectivores showed similar abundance in both habitats but forest floor and understory species were absent from the plantation within the plantation higher tree density did not lead to a greater abundance of forest birds yerba mate grown under native trees could be used to rehabilitate cleared land and allow recolonization by some atlantic forest bird species,Biodiversity and Conservation,presence and abundance of birds in an atlantic forest reserve and adjacent plantation of shade grown yerba mate in paraguay
143,during the last decades wild rabbit oryctolagus cuniculus populations have been progressively declining in the iberian peninsula as a result of several factors namely habitat deterioration hence habitat management has become one of the most commonly used management techniques to restore wild rabbit populations to test the efficacy of some of these measures creation of pastures opening firebreaks in rabbit populations two managed m and m and two control areas c and c were selected in the portuguese southwest sw coast in each study area the influence of habitat management was tested assessing temporal changes in rabbit abundance obtained from pellet counts and in rabbits diet through microhistological analysis of fecal pellets rabbit densities were higher in managed than in control areas mean annual values m pellets m m pellets m c pellets m c pellets m in general gramineae was the most consumed plant group throughout the year and in all study areas in control areas consumption of alternative species with low nutritive value e g cistus ladanifer was observed especially in summer our data suggest a positive influence of habitat management on rabbit populations since in managed areas individuals presented an overall higher abundance and a more nutritive diet in addition there was no evidence that sown species were consumed in detriment to naturally occurring grasses suggesting that in mediterranean semi arid regions clearing vegetation inside the scrubland might be sufficient to improve habitat conditions for rabbits,ICN and CIBIO Report,impacto da implementação de medidas de gestão do habitat nas populações de coelho bravo oryctolagus cuniculus algirus no parque natural do sudoeste alentejano e costa vicentina
144,the atlantic forest is considered one of the most diverse biome in the world harboring a large number of endemic species however it is one of the most degraded ecosystems in brazil less than of its original vegetation has been preserved in southeastern part of the state of bahia irresponsible deforestation and misuse of land have being degrading the forest in this area the termite fauna is poorly known and there was no available survey this paper aimed to carry out a first survey on the isoptera from this region of the atlantic forest to compare the termite richness between primary and secondary forests using two kind of collecting protocols to compare the results from the two different collecting protocols to classify the species into trophic groups the study areas are mata da esperança primary forest and reserva zoobotânica da ceplac secondary forest both in the county of ilhéus ba quantitative and qualitative surveys followed standard protocols and the samples were obtained directly without baits thirty eight species within twenty seven genera were identified and the family termitidae was the most frequent the termite fauna of the primary forest was the richest nineteen and thirty three species were registered with the quantitative and qualitative protocol respectively the majority of the species was classified as xilophagous,"Iheringia, Série Zoologia",termite insecta isoptera richness in primary and secondary atlantic forest in southeastern bahia
145,we analyze the impact of grazing on dung beetle diversity at the barranca de metztitlán biosphere reserve a xeric ecosystem in central mexico with a long history of use by humans we compared the community structure as well as the alpha and beta diversity between two cover conditions open and closed vegetation that represent the impact of grazing within a habitat and between habitat types submountainous and crassicaule scrublands from samples we collected dung beetles belonging to taxa while mean species richness and diversity were different between habitat types cumulative species richness was not the effects of grazing on vegetation structure influenced the cumulative species richness and diversity of dung beetles in the submountainous scrubland where grazing has created land mosaics of a grassland matrix with scrubland patches this was not the case in the crassicaule scrubland where the impact of grazing is not as evident beta diversity significantly responds to the effects of grazing on habitat conditions we discuss the ecological factors that may promote these responses by landscape diversity components we also identify the species that could act as useful indicators to monitor the effect of land management on biodiversity our results indicate cattle farming maintains a diversified land mosaic and these areas support more diverse dung beetle ensembles than homogeneous areas of closed shrubby vegetation cover thus controlled grazing activity could certainly favour the conservation of dung beetle biodiversity and improve ecosystem functioning by maintaining dung decomposition rates,Biological Conservation,grazing promotes dung beetle diversity in the xeric landscape of a mexican biosphere reserve
146,neotropical deciduous forests are threatened by anthropogenic activities and only a small area is protected against exploitation in contrast to other neotropical forest types not much is known about the effect of habitat disturbance on deciduous forest bird communities in the present study we examine the effects of human disturbance on a deciduous forest bird community in the andean foothills of bolivia bird community composition was determined by means of point count surveys in three forest types i e undisturbed deciduous and semi deciduous forest and disturbed forest habitat habitat disturbance was estimated indirectly by measuring vegetation structure variables in these forests the effect of habitat disturbance was subsequently examined at bird community level species richness species abundance and diversity indices and functional group level habitat preference categories and foraging guild differences in community composition and reduced species abundance could clearly be related to habitat disturbance however results also indicated that sensitivity to disturbance varied among functional groups humid forest specialists showed the strongest response to habitat disturbance predominantly bark gleaning insectivores canopy insectivores understorey insectivores and ground dwelling species whereas dry forest specialists were not affected by disturbance the present study suggests that anthropogenic disturbance negatively influenced the forest bird community in the investigated deciduous forest in bolivia this may indicate that conservation of both deciduous and semi deciduous forest remnants is relevant for a diverse montane bird community in south america because various bird species typical of deciduous forests may also be able to survive in partly disturbed forests conservation strategies should not only be focussed on the protection of pristine remnants but should also include secondary forest edge zones,Bird Conservation International,human disturbance affects a deciduous forest bird community in the andean foothills of central bolivia
