,EID,X__1,Authors,Author(s) ID,Title,Year,Source title,DOI,Link,Abstract,Document Type,Access Type,Source,p,Relevance_std,Relevance_ranked,X__2,Timespan_std,Timespan_ranked,Scopus_index,Present_in_training_docs
8,2-s2.0-15944423266,54,"Kavanagh R.P., Stanton M.A.",7004427241;8919050800;,Vertebrate species assemblages and species sensitivity to logging in the forests of north-eastern New South Wales,2005,Forest Ecology and Management,10.1016/j.foreco.2005.02.009,https://www.scopus.com/inward/record.uri?eid=2-s2.0-15944423266&doi=10.1016%2fj.foreco.2005.02.009&partnerID=40&md5=1f964634e1eb173e8eeae6ddb724a24c,"The occurrences of 227 vertebrate species recorded on 487 forested sites in north-eastern New South Wales were investigated to determine the levels of association among species, the distribution of species by broad functional groups, species relations with key environmental and disturbance variables, the sensitivity of species to intensive logging, and to list species that have potential value as direct indicators of major environmental change and which should be considered as candidates for long-term monitoring. A total of 40 species appeared to be significantly disadvantaged by logging, another 40 species appeared to be significantly favoured by logging, while the remainder (147 species) appeared to be relatively unaffected. Most species were widely distributed throughout both logged and unlogged landscapes, albeit at possibly quite different abundances. This may be due to the fine-scale complexity of the habitat mosaic for many species, resulting in the continued availability of essential resources within or near logged areas, or the lack of sufficient sensitivity in the analysis due to the need to use presence-absence data. A further 121 species were recorded so rarely in the study (based on 619 sites) that it was not possible to make any assessments of their sensitivity to logging. The study produced several unexpected results, including the failure to identify some species as sensitive to logging that had previously been identified as sensitive in experimental and other retrospective studies. Species disadvantaged by logging were often either dependent on large old trees and/or tree hollows for nesting, roosting and foraging, such as the Common Brushtail Possum, Red-browed Treecreeper, Satin Flycatcher and Crimson Rosella, or they were species that inhabit open forests and woodland, such as the Rufous Bettong, Buff-rumped Thornbill, White-throated Gerygone, White's Skink and Nobbi, that were probably disadvantaged by the increase in stem density and understorey and mid-canopy cover that usually follows logging. In contrast, species favoured by logging, such as the Eastern Whipbird, Brown Gerygone, Lewin's Honeyeater, Wonga Pigeon and Land Mullet, were often those species preferring wetter forest environments, particularly those with multi-layered foliage and a forest structure that includes fallen logs and a dense ground cover. No species displayed consistently strong preferences for selectively logged forest. Mammals were more likely to be disadvantaged by logging than birds, but reptiles contained the largest proportion of species sensitive to logging (39%). Frogs were inadequately sampled in this study; only nine species were recorded. While each taxonomic group had some species that were apparently sensitive to logging, the time frame to population recovery following logging disturbance may differ widely between groups depending on their habitat requirements. Fire history was also strongly correlated with the occurrences of many species, indicating the need to quantify species sensitivity to regular fuel-reduction burning. Three main assemblages of species were identified. One group consisted of rainforest or wet forest specialists, another group comprised open-forest generalists, including a number of open-country and woodland species, and a third group was made up of tall, eucalypt forest generalists, including all of the large forest owls and marsupial gliders. Each broad assemblage, and most of their sub-groups, were found to have at least one species that was apparently sensitive to logging. The study was unable to test whether these sensitive species can function effectively as indicators of the changing status of other species within each assemblage because sampling was undertaken only once at each site. This study has provided one of the few opportunities to date to critically evaluate some aspects of the indicator species concept and its potential as a management shortcut for assessing changes in biodiversity in managed forest landscapes. Qualified support for the concept has been shown, based on the identification of a set of species apparently sensitive to logging and their representation across a range of species assemblages. The choice of candidate species for monitoring will depend on the integration of results from other experimental and retrospective studies, and will be specific to each region depending on the composition of species assemblages and the goals of management. © 2005 Elsevier B.V. All rights reserved.",Article,NA,Scopus,0.578917157,NA,NA,NA,NA,NA,55,NA
5,2-s2.0-10044271228,55,"Chilvers B.L., Lawler I.R., Macknight F., Marsh H., Noad M., Paterson R.",6602572083;6701516962;6508268490;35449023800;6506393830;7103355199;,"Moreton Bay, Queensland, Australia: An example of the co-existence of significant marine mammal populations and large-scale coastal development",2005,Biological Conservation,10.1016/j.biocon.2004.08.013,https://www.scopus.com/inward/record.uri?eid=2-s2.0-10044271228&doi=10.1016%2fj.biocon.2004.08.013&partnerID=40&md5=b539e8a6e67e75fd3be755363687e89d,"Recent analyses assert that large marine vertebrates such as marine mammals are now 'functionally or entirely extinct in most coastal ecosystems'. Moreton Bay is a large diverse marine ecosystem bordering the fastest growing area in Australia. The human population is over 1.6 million and increasing yearly by between 10% and 13% with resultant impacts upon the adjoining marine environment. Nonetheless, significant populations of three species of marine mammals are resident within Moreton Bay and a further 14 species are seasonal or occasional visitors. This paper reviews the current and historical distributions and abundance of these species in the context of the current management regime and suggests initiatives to increase the resilience of marine mammal populations to the changes wrought by the burgeoning human population in coastal environments. © 2004 Elsevier Ltd. All rights reserved.",Article,NA,Scopus,0.665523963,NA,NA,NA,NA,NA,56,NA
11,2-s2.0-17644392871,56,"Andersen A.N., Cook G.D., Corbett L.K., Douglas M.M., Eager R.W., Russell-Smith J., Setterfield S.A., Williams R.J., Woinarski J.C.Z.",7402511157;7401953842;7003471935;7202715945;6701802100;55911705800;6602362659;55612751800;57203255851;,Fire frequency and biodiversity conservation in Australian tropical savannas: Implications from the Kapalga fire experiment,2005,Austral Ecology,10.1111/j.1442-9993.2005.01441.x,https://www.scopus.com/inward/record.uri?eid=2-s2.0-17644392871&doi=10.1111%2fj.1442-9993.2005.01441.x&partnerID=40&md5=6e0a093e6f41a3b632265250f8073548,"Every year large proportions of northern Australia's tropical savanna landscapes are burnt, resulting in high fire frequencies and short intervals between fires. The dominant fire management paradigm in these regions is the use of low-intensity prescribed fire early in the dry season, to reduce the incidence of higher-intensity, more extensive wildfire later in the year. This use of frequent prescribed fire to mitigate against high-intensity wildfire has parallels with fire management in temperate forests of southern Australia. However, unlike in southern Australia, the ecological implications of high fire frequency have received little attention in the north. CSIRO and collaborators recently completed a landscape-scale fire experiment at Kapalga in Kakadu National Park, Northern Territory, Australia, and here we provide a synthesis of the effects of experimental fire regimes on biodiversity, with particular consideration of fire frequency and, more specifically, time-since-fire. Two recurring themes emerged from Kapalga. First, much of the savanna biota is remarkably resilient to fire, even of high intensity. Over the 5-year experimental period, the abundance of most invertebrate groups remained unaffected by fire treatment, as did the abundance of most vertebrate species, and we were unable to detect any effect of fire on floristic composition of the grass-layer. Riparian vegetation and associated stream biota, as well as small mammals, were notable exceptions to this general resilience. Second, the occurrence of fire, independent of its intensity, was often the major factor influencing fire-sensitive species. This was especially the case for extinction-prone small mammals, which have suffered serious population declines across northern Australia in recent decades. Results from Kapalga indicate that key components of the savanna biota of northern Australia favour habitat that has remained unburnt for at least several years. This raises a serious conservation concern, given that very little relatively long unburnt habitat currently occurs in conservation reserves, with most sites being burnt at least once every 2 years. We propose a conservation objective of increasing the area that remains relatively long unburnt. This could be achieved either by reducing the proportion of the landscape burnt each year, or by setting prescribed fires more strategically. The provision of appropriately long unburnt habitat is a conservation challenge for Australia's tropical savanna landscapes, just as it is for its temperate forests.",Article,NA,Scopus,0.522664581,NA,NA,NA,NA,NA,57,NA
7,2-s2.0-15944418980,57,"Marsh H., De'ath G., Gribble N., Lane B.",35449023800;55921854100;6602517126;7202428992;,Historical marine population estimates: Triggers or targets for conservation? The dugong case study,2005,Ecological Applications,10.1890/04-0673,https://www.scopus.com/inward/record.uri?eid=2-s2.0-15944418980&doi=10.1890%2f04-0673&partnerID=40&md5=da2cdc594f757accbe2c8313a0adc916,"Recent studies have estimated the historical abundance of large marine vertebrates to determine potential targets for conservation. We evaluated this approach using 1990s aerial survey estimates of dugong abundance and an estimate of the decline in dugong numbers since the 1960s based on changes in the catch per unit effort of dugong bycatch in a government shark control program on the east coast of Queensland, Australia. This analysis indicated that the catch rate of dugongs caught in shark nets, at six locations between latitudes 16.5° S and 28° S, declined at an average of 8.7% per year between 1962 and 1999. This represents a decline to 3.1% of initial catch rates over the sampling period. If the changes in the populations sampled by the shark nets and aerial surveys were equivalent, this result suggests that the region supported 72 000 dugongs in the early 1960s compared with an estimated 4220 dugongs in the mid-1990s. The seagrass habitat in the region is currently insufficient to support 72 000 dugongs, suggesting that our hindcast estimate may be an unrealistic target for recovery. Nonetheless, the evidence of serious dugong decline from the shark-net data and other sources has triggered significant conservation initiatives. This case study indicates that comparisons between historical and contemporary estimates of the abundance of large marine vertebrates can be powerful qualitative triggers for conservation action, but that quantitative targets for recovery require systematic testing of the assumptions underlying hindcast estimates, scientific evaluation of the current carrying capacity of the ecosystem for the target species, and consultation with a broad range of stakeholders. For some species, it may be more productive to set anthropogenic mortality targets that are designed to enable the population to recover to its optimum sustainable population than to set recovery targets per se. © 2005 by the Ecological Society of America.",Article,NA,Scopus,0.834357209,NA,1,NA,NA,5,58,NA
12,2-s2.0-18244400241,58,"Gormley A.M., Dawson S.M., Slooten E., Bräger S.",6506189292;7202901010;6603949910;6701905377;,"Capture-recapture estimates of Hector's dolphin abundance at Banks Peninsula, New Zealand",2005,Marine Mammal Science,10.1111/j.1748-7692.2005.tb01224.x,https://www.scopus.com/inward/record.uri?eid=2-s2.0-18244400241&doi=10.1111%2fj.1748-7692.2005.tb01224.x&partnerID=40&md5=e2a9bdb82855833eb508c39bc1f35e41,"Capture-recapture techniques have been extensively used to estimate survival rates of Hector's dolphins at Banks Peninsula, but not abundance. We analyzed nine seasons of photo-identification data using a model-fitting approach in the computer program MARK, and then used MARK's estimates of capture probabilities to calculate the abundance of distinctive individuals. We extrapolated these estimates to include unmarked individuals using five seasons of data on the proportion of identifiable individuals in this population, obtained from ""random photography."" This capture-recapture approach suggests a 1996 population of about 1,100 (CV = 0.21). This is very similar to the 1997 line-transect estimate of about 900 (CV = 0.28), especially considering that the two techniques do not necessarily measure the same thing. An important advantage of the capture-recapture approach stems from the inherent versatility of photo-ID data. If the sampling design is appropriate, an unbiased abundance estimate can be achieved as a spin-off from work directed at other questions. However, in our view, line-transect estimates are easier to interpret because the sampling design is explicit. © 2005 by the Society for Marine Mammalogy.",Article,NA,Scopus,0.700678933,NA,NA,NA,NA,NA,59,NA
20,2-s2.0-30444452803,59,"Spurr E.B., Wright G.R.G., Radford C.D., Brown L.E., Maitland M.J., Taylor G.E.",7003815307;7402848513;11240007800;8895672700;11239458500;55454322200;,"Residues of brodifacoum and other anticoagulant pesticides in target and non‐target species, Nelson Lakes National Park, New Zealand",2005,New Zealand Journal of Zoology,10.1080/03014223.2005.9518416,https://www.scopus.com/inward/record.uri?eid=2-s2.0-30444452803&doi=10.1080%2f03014223.2005.9518416&partnerID=40&md5=c688193833b358aa3ba9e53cba4dc547,"Cereal‐based bait containing 20 ppm brodifacoum was used in bait stations continuously from December 1997 to August 2000 in the Rotoiti Nature Recovery Project area, for controlling brushtail possum (Trichosurus vulpecula), ship rat (Rattus rattus), and house mouse (Mus musculus) populations. Concurrently (and before and after), baits containing brodifacoum, bromadiolone, flocoumafen, coumatetralyl, or warfarin were also used in St Arnaud village and on farms immediately adjacent to the project area. Brodifacoum residues were detected in the livers of 234 mammals from eight species, and two birds from two species captured alive, and a further seven birds from five species found dead in the project area (cause of death unknown). The highest concentration of brodifacoum residues in mammalian livers was recorded during the period brodifacoum was used in the project area. However, residues were present in the livers of some individuals at least 24 months after brodifacoum use in the project area stopped. These residues may have persisted in animals surviving brodifacoum use in the project area, and/or been transported into the area by animals moving to and from the adjacent village and farms, where brodifacoum use continued. Residues of flocoumafen, coumatetralyl, or warfarin, used only in the village and on farms, were also detected in the livers of animals captured up to at least 8 km from the nearest source. The results concur with other studies cautioning against indiscriminate or prolonged use of persistent anticoagulants for vertebrate pest control. However, the risks from such pesticides must be balanced against the demonstrable benefits of reducing pest abundance. © The Royal Society of New Zealand 2005.",Article,Open Access,Scopus,0.57699586,NA,NA,NA,NA,NA,60,NA
36,2-s2.0-33751303435,60,Short J.,7202306197;,Mammal decline in southern Western Australia - Perspectives from Shortridge's collections of mammals in 1904-07,2004,Australian Zoologist,NA,https://www.scopus.com/inward/record.uri?eid=2-s2.0-33751303435&partnerID=40&md5=4071f77861ef63f3895d34794a9d3b3b,"Guy Shortridge made extensive collections of mammals in southern Western Australia in the years 1904 to 1907, less than 80 years after first European settlement of the area. This paper reviews Shortridge's unpublished letters and the published papers that resulted from his collections in a reexamination of the temporal and spatial patterns of decline of these mammals. Shortridge collected a monotreme, 25 species of marsupial, 10 species of bat, 8 species of rodent, as well as rabbits and dingoes (a total of 46 species). He collected in five broad regions: mesic woodland sites in what is now the western wheatbelt; mesic coastal scrub sites around Albany; mesic forest habitat in the far south-west corner at Margaret River, Busselton, and Bunbury; semi-arid pastoral sites at Carnarvon and Gascoyne Junction; and semi-arid mining sites at Southern Cross, Kalgoorlie and Laverton. Shortridge was struck particularly by the rich fauna of the mesic woodland and the lack of species in the semi-arid interior (he obtained 20 terrestrial native species at the former and only 3-5 species at the latter). However, since that time, several of the species Shortridge collected at the mesic woodland sites have become extinct on mainland Australia (Bettongia lesueur, Lagostrophus fasciatus, and Perameles bougainville) or are now extinct (Onchogalea lunata) and the region shows one of the highest losses of mammals within Australia. Shortridge's collections emphasise that the loss of mammals in Western Australia has been a two-step process, with an initial loss of mammals in the semi-arid interior, followed by a subsequent loss from mesic woodland and coastal sites. His collections preceded the arrival of foxes Vulpes vulpes to the State and largely preceded the spread of rabbits Oryctolagus cuniculus. Shortridge speculated that disease, predation by feral cats Felis catus, competition from house mice Mus musculus, and bushfires were major factors in overall decline, and the impact of closer settlement was important in localised declines. These, and other factors commonly cited as reasons for mammal decline (grazing and land clearing), are evaluated. The factors suggested by Shortridge for overall decline are potentially interlinked: feral cats or house mice may spread disease, feral cats may be more effective as predators in the presence of abundant house mice populations and at sites where vegetation refuges are reduced by fire, and both may reach highest densities around farms and settlements. The pattern of loss to 1907 can be explained by the spread of feral cats only if their impact on native mammals is high in semi-arid pastoral and mining areas, low in mesic areas, and low in arid areas where European impact was minimal. Possible mechanisms for such a variable impact of feral cats include: i) greater density of vegetation at mesic sites providing refuge for prey species; ii) protection conferred to prey species by poison plants Gastrolobium in the understorey of mesic woodland leading to secondary poisoning of predators; and iii) Aboriginal hunting of feral cats being effective in limiting the density and impact of cats in remote areas beyond the frontier of European colonisation.",Review,NA,Scopus,0.677563218,NA,NA,NA,NA,NA,61,NA
16,2-s2.0-23944496397,61,"Morris K., Sims C., Himbeck K., Christensen P., Sercombe N., Ward B., Noakes N.",7202939036;7102638415;8696953000;7202250392;8696953300;14122727400;8696953500;,"Project Eden - Fauna recovery on Peron Peninsula, Shark Bay: Western Shield review - February 2003",2004,Conservation Science Western Australia,NA,https://www.scopus.com/inward/record.uri?eid=2-s2.0-23944496397&partnerID=40&md5=534bf6c4d02f13e3ebbfee994f8dfea1,"The Shark Bay area was one of the more mammal rich parts of Western Australia before European settlement. Over the last 200 years, 60% of the native mammals have become locally extinct in this area. Project Eden commenced on Peron Peninsula, Shark Bay in 1994. Its objectives were to a) control or eradicate the introduced fauna, b) reconstruct the native fauna of the peninsula, and c) to promote nature - based tourism based on the unique Shark Bay fauna. Control of sheep, goats and foxes has been successful. Feral cat control has been difficult in the presence of large numbers of rabbits and other prey, however significant advances in the development of an effective feral cat control method have been made. A better understanding of the factors influencing the uptake of baits by feral cats has also been achieved. A captive breeding centre was established to provide animals for translocation. This ensured that wild populations of species restricted to islands or small parts of the mainland were not detrimentally impacted by the removal of large numbers of founders for translocation. Between 1996 and 2002, nearly 70 malleefowl and 150 mammals were bred/reared in captivity and 155 have been released. Malleefowl and bilbies have been successfully reintroduced to Peron Peninsula. Mala and banded hare-wallabies did not persist due primarily to cat predation. Woylies were reintroduced from other wild populations and are persisting in low numbers. Extant small vertebrate population abundances appear to respond more to rainfall events, rather than cat predation, while larger extant vertebrates have increased since sheep, goat, fox and feral cat control has been implemented. While feral cat control has been demonstrated for short periods, additional work is required to reduce their numbers further, and for longer periods before additional native species can be translocated. In addition to the re-establishment of native fauna and the enhancement of the remnant native fauna, Project Eden has provided many benefits relating to the management of pest species and native fauna in the arid zone. In light of the findings to date, it is proposed that the objectives of this project be revised and that certain actions are necessary to ensure future success. These include a refinement of feral cat control methods, the development and use of models to predict optimum bait uptake times, a review of species suitable for translocation, and the adequacy of existing staff numbers and captive breeding facilities.",Review,NA,Scopus,0.692646594,NA,NA,NA,NA,NA,62,NA
