,EID,X__1,Unnamed: 0,Authors,Author(s) ID,Title,Year,Source title,DOI,Link,Abstract,Document Type,Source,p,Relevance_std,Relevance_ranked,X__2,Timespan_std,Timespan_ranked,Relevance_std_mod,Timespan_std_mod,Scopus_index,Present_in_training_docs
167,2-s2.0-85046720983,40,40,"Labadie G., Tixier P., Barbraud C., Fay R., Gasco N., Duhamel G., Guinet C.",57203329155;36700464300;35616520600;56710994000;24485375900;7102858141;7005381471;,First demographic insights on historically harvested and poorly known male sperm whale populations off the Crozet and Kerguelen Islands (Southern Ocean),2018,Marine Mammal Science,10.1111/mms.12469,https://www.scopus.com/inward/record.uri?eid=2-s2.0-85046720983&doi=10.1111%2fmms.12469&partnerID=40&md5=7de4b6ebe8c420b74000622d46ce3571,"Age and sex dependent spatial segregation has resulted in limited knowledge of the ecology and demography of sperm whale adult males feeding seasonally in high latitudes. This study focused on adult males interacting with the Patagonian toothfish (Dissostichus eleginoides) fishery operating off the Kerguelen and Crozet Archipelagos. Demographic parameters were estimated using a 10-yr-long photo-identification data set paired with multistate closed robust design capture-mark-recapture models. The examination of a set of 29,078 photographs taken from fishing vessels during sperm whale depredation events resulted in identification of 295 individuals with nine visiting both study areas. Dispersal between both study regions was estimated to be 1% per year. The mean annual number of interacting sperm whales was estimated to n = 82 (95% CI 58–141) in Crozet and n = 106 (95% CI 76–174) in Kerguelen. Transient proportions were 13% in Crozet and 26% in Kerguelen. Corrected for transience, apparent survival estimates were 0.953 (95% CI 0.890–0.993) in Crozet, and 0.911 (95% CI 0.804–0.986) in Kerguelen. These survival and population size estimates are the first for depredating adult males in high latitudes, and can be used in evaluating the current conservation status of this historically harvested stock and to investigate depredation trends in 35 both Crozet and Kerguelen Islands. © 2018 Society for Marine Mammalogy",Article,Scopus,0.724488433,NA,NA,NA,NA,NA,,,41,NA
20,2-s2.0-0031841939,135,135,"Croll D.A., Tershy B.R.",7004594817;6603678744;,"Penguins, fur seals, and fishing: Prey requirements and potential competition in the South Shetland Islands, Antarctica",1998,Polar Biology,10.1007/s003000050261,https://www.scopus.com/inward/record.uri?eid=2-s2.0-0031841939&doi=10.1007%2fs003000050261&partnerID=40&md5=3a34dec6504b352dc73f7ab66a46a8ef,"Antarctic and sub-Antarctic seabirds, marine mammals, and human fisheries concentrate their foraging efforts on a single species, Antarctic krill (Euphausia superba). Because these predators may have a significant effect on krill abundance, we estimated the energy and prey requirements of Adelie (Pygoscelis adeliae), chinstrap (Pygoscelis antarctica), and gentoo (Pygoscelis papua) penguins and female Antarctic fur seals (Arctocephalus gazella) breeding on the South Shetland Islands, Antarctica and compared these estimates with catch statistics from the Antarctic krill fishery. Published data on field metabolic rate, population size, diet, prey energy content, and metabolic efficiency were used to estimate prey requirements of these breeding, adult, land-based predators and their dependent offspring. Due to their large population size, chinstrap penguins were the most significant krill predators during the period examined, consuming an estimated 7.8 x 108 kg krill, followed by Adelie penguins (3.1 x 107 kg), gentoo penguins (1.2 x 107 kg), and Antarctic fur seals (3.6 x 106 kg). Total consumption of all land-based predators on the South Shetland Islands was estimated at 8.3 x 108 kg krill. The commercial krill fishery harvest in the South Shetland Island region (1.0 x 108 kg) was approximately 12% of this. Commercial harvest coincides seasonally and spatially with peak penguin and fur seal prey demands, and may affect prey availability to penguins and fur seals. This differs from the conclusions of Ichii et al. who asserted that the potential for competition between South Shetland predators and the commercial krill fishery is low.",Article,Scopus,0.724343624,NA,NA,NA,NA,NA,,,136,NA
41,2-s2.0-0242669244,30,30,"Ruhl H.A., Hastings P.A., Zarubick L.A., Jensen R.M., Zdzitowiecki K.",7005369380;35809580200;6506708535;7403517899;55955071700;,"Fish populations of Port Foster, Deception Island, Antarctica and vicinity",2003,Deep-Sea Research Part II: Topical Studies in Oceanography,10.1016/S0967-0645(03)00094-8,https://www.scopus.com/inward/record.uri?eid=2-s2.0-0242669244&doi=10.1016%2fS0967-0645%2803%2900094-8&partnerID=40&md5=f4902a6e41183e94af04982e024ff6ae,"The fish populations of Port Foster, Deception Island, South Shetland Islands, Antarctica, were investigated as part of the Erupt Antarctic ecosystem study. Surveys were conducted on five cruises between March 1999 and November 2000. Samples also were collected off Livingston Island and King George Island of the South Shetland Islands. Specimens were collected or observed using a multiple opening and closing net and environmental sampling system, otter trawls, benthic line-transect photography, and remotely operated vehicle video. Species composition, length, weight, reproductive condition, diet, habitat, and parasitic infestation were examined for the dominant fish species. Eleven species were collected, all in the suborder Notothenioidei. The fishes found in the survey are known to occur in the region and had diets similar to those found in other studies. Abundances of demersal fishes in Port Foster ranged from 0.05 to 0.10 individuals m-2 over the study period. Inshore shallow-water (&lt;30 m) and inshore deep-water (&gt; 30 m) habitats are identified in Port Foster and described. Port Foster may be a refuge for juvenile fishes such as Champsocephalus gunnari. Limited exchange with the surrounding waters also may limit the influence of recruitment and prey abundance fluctuations outside Port Foster. Trematomus scotti had heavy body cavity parasite infestation from Port Foster, possibly due in part to decreased benthic scour from large icebergs, allowing benthic parasites to persist. © 2003 Elsevier Ltd. All rights reserved.",Article,Scopus,0.721327113,1,NA,Corrected unranked class to 1,15,NA,1,15,31,NA
79,2-s2.0-77954160232,10,10,"Péron C., Authier M., Barbraud C., Delord K., Besson D., Weimerskirch H.",36150339600;15079115300;35616520600;6506656820;24340627700;56213156300;,Interdecadal changes in at-sea distribution and abundance of subantarctic seabirds along a latitudinal gradient in the Southern Indian Ocean,2010,Global Change Biology,10.1111/j.1365-2486.2010.02169.x,https://www.scopus.com/inward/record.uri?eid=2-s2.0-77954160232&doi=10.1111%2fj.1365-2486.2010.02169.x&partnerID=40&md5=62cba29033c9cefa431e02780f1afd30,"Long-term demographic studies have recently shown that global climate change together with increasing direct impacts of human activities, such as fisheries, are affecting the population dynamics of marine top predators. However, the effects of these factors on species distribution and abundance at sea are still poorly understood, particularly in marine ecosystems of the southern hemisphere. Using a unique long-term data set of at-sea observations, we tested for interdecadal (1980s vs. 2000s) changes in summer abundance and distribution of 12 species of Albatrosses and Petrels along a 30° latitudinal gradient between tropical and Antarctic waters of the southern Indian Ocean. There were contrasting effects of climate change on subantarctic seabird distribution and abundance at sea. While subtropical waters showed the highest rate of warming, the species that visited this water mass showed the greatest changes in distribution and abundance. The abundance of Wandering Albatrosses (Diomedea exulans), White-chinned Petrels (Procellaria aequinoctialis) and Giant Petrels (Macronectes sp.) declined markedly, whereas the other species showed contrasting trends or did not change. With the exception of the White-chinned Petrel, these decreases were at least partly related to regional increase in sea surface temperature. The southward shift of Wandering Albatross and Prions (Pachyptila spp.) distributions could be ascribed to species redistribution or decrease in abundance due to warming of the subtropical waters. Surprisingly, White-chinned Petrel distribution shifted northward, suggesting more complex mechanisms. This study is the first to document a shift in species range in the Southern Ocean related to climate change and contrasting abundance changes. It suggests that some species might experience more severe impacts from climate change depending on the water masses they visit. As climate changes are predicted to continue in the next decades, understanding species responses to climate change is crucial for conservation management, especially when their conservation status is critical or unknown. © 2010 Blackwell Publishing Ltd.",Article,Scopus,0.716317044,1,NA,NA,5,NA,1,5,11,NA
101,2-s2.0-84856340490,67,67,"Iwami T., Naganobu M., Taki K., Kiyota M.",7004403663;6601953604;22636323700;11141639400;,"Annual changes in species composition and abundance of myctophid fish in the north of South Georgia (subarea 48.3), antarctica, during austral winters from 2002 to 2008",2011,CCAMLR Science,NA,https://www.scopus.com/inward/record.uri?eid=2-s2.0-84856340490&partnerID=40&md5=1c24d894e8dfc4db856020c4c29d3e8c,"Species composition and abundance of myctophid fish were analysed using the fish by-catch samples collected by scientific observers on board Japanese commercial krill fishing vessels in the area north and northwest of South Georgia, Antarctica, during austral winters from 2002 to 2008. A total of 10 myctophid species were identified in the by-catch samples, among which Krefftichthys anderssoni, Gymnoscopelus nicholsi and Protomyctophum choriodon were abundant. Different life stages of K. anderssoni and G. nicholsi from larvae to adults were found, suggesting that these species may have their nursery ground around South Georgia. Electrona antarctica was not a major component of the recent mesopelagic ichthyofauna in this area, although this species used to be dominant in the Antarctic coastal waters. In contrast, P. choriodon, which is known as a south temperate species, became dominant in recent samples. Additionally, the size distribution of P. choriodon was unimodal, indicating that individuals in the samples belonged to the same size group and probably migrated from the population in warmer northern areas.",Note,Scopus,0.715420581,NA,NA,NA,NA,NA,,,68,NA
168,2-s2.0-85048067810,121,121,"Reisinger R.R., Landman M., Mgibantaka N., Smale M.J., Bester M.N., De Bruyn P.J.N., Pistorius P.A.",25960361100;16040041000;57202382903;36642207100;7005684769;9043754700;7006186946;,"Overlap and temporal variation in the diets of sympatric Antarctic and Subantarctic fur seals (Arctocephalus spp.) at Marion Island, Prince Edward Islands",2018,Polar Research,10.1080/17518369.2018.1451142,https://www.scopus.com/inward/record.uri?eid=2-s2.0-85048067810&doi=10.1080%2f17518369.2018.1451142&partnerID=40&md5=2add9c162cd3674f28330ae81b6253d9,"Antarctic (Arctocephalus gazella) and Subantarctic (A. tropicalis) fur seals are important predators in the Southern Ocean. Marion Island (southern Indian Ocean) hosts the largest sympatric breeding populations of these two species. Environmental and population changes here over two decades may have influenced their diet and trophic interactions. To quantify diet, we analysed prey remains in scat samples from Antarctic (661 scats) and Subantarctic (750 scats) fur seals collected at Marion Island (2006–2010). We assessed diet composition over time and calculated dietary overlap. The diet of both species was dominated by fish prey (98.2% and 99.4% of prey items), mainly myctophids. Antarctic fur seals consumed small numbers of penguins, cephalopods and crustaceans. In Subantarctic fur seal scats, crustaceans and cephalopods were rare and penguin remains were absent. The diets of the two species overlapped substantially (Pianka’s index = 0.98), however, small but significant differences in the relative proportions of prey were evident. Seasonal and annual diet changes suggest that their diet is similarly influenced by patterns of local prey availability and abundance. Despite substantial changes in the population size and trajectory of Antarctic and Subantarctic fur seals–which would be expected to influence trophic interactions between them–comparing our data to those from earlier studies (1989–2000) did not reveal significant long-term dietary changes in either species. © 2018 The Author(s). Published by Informa UK Limited, trading as Taylor & Francis Group.",Article,Scopus,0.712286521,NA,NA,NA,NA,NA,,,122,NA
118,2-s2.0-84880645830,6,6,"Ainley D.G., Nur N., Eastman J.T., Ballard G., Parkinson C.L., Evans C.W., Devries A.L.",7003309400;6701664965;7102271199;7003323790;7102253099;7403479974;7004771966;,"Decadal trends in abundance, size and condition of Antarctic toothfish in McMurdo Sound, Antarctica, 1972-2011",2013,Fish and Fisheries,10.1111/j.1467-2979.2012.00474.x,https://www.scopus.com/inward/record.uri?eid=2-s2.0-84880645830&doi=10.1111%2fj.1467-2979.2012.00474.x&partnerID=40&md5=07eb871e6eb3a20939ac0a95a165a29d,"We report the analyses of a dataset spanning 39 years of near-annual fishing for Dissostichus mawsoni in McMurdo Sound, Antarctica, 1972-2011. Data on total length, condition and catch per unit effort (CPUE) were derived from the > 5500 fish caught, the large majority of which were measured, tagged and released. Contrary to expectation, the length frequency of the McMurdo Sound catch was dominated by fish in the upper two-thirds of the overall distribution exhibited in the industrial catch for the Ross Sea shelf. Fish length and condition increased from the early 1970s to the early 1990s and then decreased. Fish length positively correlated with Ross Sea ice extent in early spring, a relationship possibly caused by more ice encouraging larger fish to move farther south over the shelf and into the study area. Fish condition positively correlated with the amount of open water in the Ross Sea during the previous summer (Feb), perhaps reflecting greater availability of prey with the higher productivity that more open water brings. Decreasing fish size corresponds to the onset of the fishery, which targets the large individuals. CPUE was constant through 2001 and then decreased dramatically. We hypothesize that this decrease is related to the industrial fishery, which began in the 1996-97 austral summer, and concentrates effort over the ice-free Ross Sea continental slope. As a result of limited prey choices and close coupling among mesopredators of the region, Antarctic toothfish included, the fishery appears to be dramatically altering the trophic structure of the Ross Sea. © 2012 John Wiley & Sons Ltd.",Article,Scopus,0.709241083,1,NA,NA,5,NA,,,7,1
123,2-s2.0-84893404542,114,114,Japoshvili B.,23476953000;,"Long-term assessment of a vendace (Coregonus albula l.) stock in lake paravani, south georgia",2012,Advances in Limnology,10.1127/advlim/63/2012/363,https://www.scopus.com/inward/record.uri?eid=2-s2.0-84893404542&doi=10.1127%2fadvlim%2f63%2f2012%2f363&partnerID=40&md5=d544c15a2b38eb8421b569441c7aaad2,"A total sample of 1854 vendace (Coregonus albula L.) specimens was collected on a seasonal basis from Lake Paravani during 1999-2005. Nets of different types (seines, trap nets and gillnets) with various mesh sizes and length were used for sampling. Samples were collected from 3 horizontal strata. In the samples collected, most vendace were age 1+ and 2+ although a few individuals lived to age 4. Vendace is the dominant species comprising 70 % of the annual catch. Catches from this study were compared with historical data. It was found that the annual abundance of vendace decreased dramatically from 1994 to present, from 50 tonnes to 17 tonnes or less annually. The average size of vendace in catches has also decreased in recent years. We believe intensive poaching, in addition to commercial fishing, climate changes and global warming, are the leading factors that have caused the decrease in overall number of individuals and the smaller sizes of adult vendace in the current population. © 2012 E. Schweizerbart'sche Verlagsbuchhandlung, 70176 Stuttgart, Germany.",Article,Scopus,0.704466666,NA,NA,NA,NA,NA,,,115,NA
60,2-s2.0-48249155482,170,170,Dee Boersma P.,7004006125;,Penguins as marine sentinels,2008,BioScience,10.1641/B580707,https://www.scopus.com/inward/record.uri?eid=2-s2.0-48249155482&doi=10.1641%2fB580707&partnerID=40&md5=97b173804a5e1ff6bb9b030908401e5a,"From the tropics to Antarctica, penguins depend on predictable regions of high ocean productivity where their prey aggregate. Increases in precipitation and reductions in sea ice associated with climate warming are affecting penguins. The largest breeding colony of Patagonian (Magellanic) penguins, at Punta Tombo, Argentina, had approximately 200,000 breeding pairs in October 2006 - a decline of 22% since 1987. In the 1980s and 1990s, petroleum pollution was a major source of Patagonian penguin mortality. In 1994, tanker lanes were moved 40 kilometers (km) farther off the coast of Chubut, and the dumping of ballast water and the oiling of penguins are now rare. However, penguins are swimming 60 km farther north from their nests during incubation than they did a decade ago, very likely reflecting shifts in prey in response to climate change and reductions in prey abundance caused by commercial fishing. These temperate penguin species, marine sentinels for southern oceans, demonstrate that new challenges are confronting their populations. © 2008 American Institute of Biological Sciences.",Article,Scopus,0.704357021,NA,NA,NA,NA,NA,,,171,1
10,2-s2.0-0022210044,164,164,"Blankley W.O., Branch G.M.",6602668081;7005555761;,Ecology of the limpet Nacella delesserti (Philippi) at Marion Island in the sub-Antarctic southern ocean,1985,Journal of Experimental Marine Biology and Ecology,10.1016/0022-0981(85)90099-1,https://www.scopus.com/inward/record.uri?eid=2-s2.0-0022210044&doi=10.1016%2f0022-0981%2885%2990099-1&partnerID=40&md5=9fc7ee436d2920d930a4c424643c07eb,"The ecology of Nacella delesserti (Philippi) is described from studies of its biomass, habitats, feeding, growth and its rôle as a central prey species at sub-Antarctic Marion Island. N. delesserti is the most abundant macro-invertebrate on the shores of Marion Island. Mean densities in the intertidal boulder fields and in the subtidal zone are 936 and 158·m-2, respectively, with an overall mean of 209·m-2 and peak densities of 3866 and 1700·m-2 in the intertidal and subtidal zones. In subtidal areas where it exceeds ≈500·m-2 N. delesserti forms stacks or towers throughout the year, up to 42 being found one on top of the other. Mean biomass was 86.7g·m-2 and production 96.5g·m-2·yr-1, both an order of magnitude higher than previously described for any Antarctic or sub-Antarctic limpet. The main diet of N. delesserti is algal spores and sporelings, although it also grazes on the fronds of attached macroalgae. Loose fronds of the kelp Durvillaea antarctica (Chamisso in Choris) Hariot and other algae are also eaten and are probably important in sustaining the dense limpet populations. Both diet and habitat are very broad and unspecialized, probably related to the fact that Nacella delesserti is the only large invertebrate grazer on the shores of the island. Limpets held in cages and fed kelp fronds provided data on grazing rates, growth, and assimilation efficiency. Assimilation efficiency ranged from 0.14 in small limpets to 0.06 in large animals. N. delesserti is estimated to consume 779 g dry algal material·m-2·yr-1, and plays a major rôle in controlling algal distribution and abundance. Growth of free-living animals was calculated from the Von Bertalanffy equation. N. delesserti reaches ≈35 mm in the first year of growth, attaining 60 mm after ≈5 yr and living for a maximum of 8 to 10 yr. In the nearshore region mortality is ≈75% per annum in the first 1.5 yr, dropping to 40% in animals of 1.5 to 5 yr old and 15% in older limpets. The rolling of boulders is a major but unquantified source of mortality in the intertidal and shallow inshore areas. Size-specific predation by the fish Notothenia coriiceps (Richardson), starfish Anasterias rupicola (Verrill) and kelp gull Larus dominicus (Lichtenstein) accounts for, respectively, 15 to 30, 40, and 20% mortality per annum, and Nacella delesserti constitutes 27, 90, and 45% of their respective diets. Limpets with shell lengths between 25 and 50 mm are particularly vulnerable, those 〉50 mm attaining a relative refuge from predation. As a herbivore and prey species, N. delesserti is clearly a key species in the nearshore and intertidal zone of Marion Island. © 1985.",Article,Scopus,0.703815842,NA,NA,NA,NA,NA,,,165,NA
145,2-s2.0-84942985383,125,125,"Saunders R.A., Collins M.A., Ward P., Stowasser G., Shreeve R., Tarling G.A.",36723452800;7404083794;7402102122;57203673125;7004148142;6603871534;,Trophodynamics of Protomyctophum (Myctophidae) in the Scotia Sea (Southern Ocean),2015,Journal of Fish Biology,10.1111/jfb.12776,https://www.scopus.com/inward/record.uri?eid=2-s2.0-84942985383&doi=10.1111%2fjfb.12776&partnerID=40&md5=1e5924a3efc052260c112c4ddc65b921,"This study investigated spatial and temporal patterns in distribution, population structure and diet of Bolin's lanternfish Protomyctophum bolini, Tenison's lanternfish Protomyctophum tenisoni and gaptooth lanternfish Protomyctophum choriodon in the Scotia Sea using data collected by midwater trawl during spring, summer and autumn. Protomyctophum bolini was the most abundant species of the genus encountered throughout the Scotia Sea with the greatest concentrations occurring around the Antarctic Polar Front (APF). This species had a life cycle of 2+years, but spatial differences in population structure were apparent as the I-group was absent from all regions south of the APF, suggesting that the species does not recruit in the Scotia Sea. Protomyctophum tenisoni occurred mostly in waters characteristic of the APF and was absent from the southern Scotia Sea. It had a limited size range, but there was clear size-related sexual dimorphism with males significantly larger than females. The species had a life cycle of c. 2years, but the I-group (c. 1year old, 1 November to 31 October the next year) occurred only in regions close to the APF suggesting that recruitment is restricted to these waters. A seasonal southward migration for P. choriodon is likely as the species occurred mostly to the south-west of South Georgia in summer, but extended to the sea-ice sectors in autumn. Protomyctophum choriodon had a life cycle of 4+years in the Scotia Sea and the population was dominated by age classes >3years old. Larval stages were absent during the surveys for all species. Diurnal variations in vertical distribution were apparent for all three species. Interspecific variations in diet were evident, but all species were primarily copepod feeders, with Metridia spp., Rhincalanus gigas and Calanus simillimus generally dominating their diet. Small euphausiids, principally Thysanoessa spp., were also an important component of their diets, particularly for P. choriodon which had the largest body size. The spatial and temporal variations in diet for both P. bolini and P. tenisoni were broadly consistent with underlying abundance patterns within the mesozooplankton community. © 2015 The Fisheries Society of the British Isles.",Article,Scopus,0.702461559,NA,NA,NA,NA,NA,,,126,NA
