"","EID","X__1","Unnamed: 0","Authors","Author(s) ID","Title","Year","Source title","DOI","Link","Abstract","Document Type","Source","p","Relevance_std","Relevance_ranked","X__2","Timespan_std","Timespan_ranked","Scopus_index","Present_in_training_docs"
"22","2-s2.0-65449145625",34,34,"Araújo F.G., Peixoto M.G., Pinto B.C.T., Teixeira T.P.","7101718409;16022931900;10240954800;23029558800;","Distribution of guppies Poecilia reticulata (Peters, 1860) and Phalloceros caudimaculatus (Hensel, 1868) along a polluted stretch of the Paraíba do Sul River, Brazil [Distribuição dos guppies Poecilia reticulata (Peters, 1860) e Phalloceros caudimaculatus (Hensel, 1868) ao longo de um trecho poluído do rio Paraíba do Sul, Brasil]",2009,"Brazilian Journal of Biology",NA,"https://www.scopus.com/inward/record.uri?eid=2-s2.0-65449145625&partnerID=40&md5=22b267746141d6856454699c01251fc5","Cyprinodontiformes fishes (guppies) are widely distributed in Neotropical regions and use deteriorated microhabitats in rivers where few species can occur. This study was carried out in a stretch of the Paraíba do Sul River in bracketing a large urban-industrial complex. The aim was to assess eventual effects that the industrial complex could have on distribution of two closely related fish species of guppies, Phalloceros caudimaculatus and Poecilia reticulata. The area was divided into three zones: Z1, 40 km upriver of the major urban-industrial complex of Volta Redonda; Z2, just down river of the complex; and Z3, 30 km down river of the complex. Six sites (two in each zone) were sampled monthly between November 1998 and October 1999, using a standardized fishing effort with cast net throws, trays lifts and seine hauls, covering different microhabitats, that is, riffles, pools and the proximity of the river's margins. Poecilia reticulata was widely distributed, peaking at Z2, the most polluted area, while P. caudimaculatus showed the highest abundance at Z3, being almost absent in Z1. Both species occurred in high numbers throughout the year but they were scarce between April and June. Females outnumbered males for both species in most size classes and at all sites. Juveniles were more abundant than adults, with non-pregnant females outnumbering pregnant ones. Condition factor was always higher in males than females but only males P. reticulata showed significant difference among the three zones, with the highest values at Z2. The higher number of females confirms the expectation that these species can use very polluted areas and that availability of food provided by organic loads allowed their distribution all over the area. Although these two species have shown indication of spatial separation in the study area, their similar seasonal patterns of occurrence suggest that they respond in a similar way to changes in environmental conditions.","Article","Scopus",0.617284616806397,NA,0,NA,NA,15,35,NA
"23","2-s2.0-68149136842",57,57,"Mellink E., Riojas-López M., Luévano J., Wheeler J.A.","6603749580;8705857200;6506450025;30567937500;","Historic changes in Mid-winter use of Laguna Cuyutlán, Colima, Mexico, by Waterfowl",2009,"Ornitologia Neotropical",NA,"https://www.scopus.com/inward/record.uri?eid=2-s2.0-68149136842&partnerID=40&md5=637ce75cbd45ed663fad2664376606fe","To understand changes in winter waterfowl abundance at Laguna Cuyutlán, we analyzed data from the U.S. Fish and Wildlife Service Midwinter Waterfowl Surveys. Data exhibited the plummeting of waterfowl abundance in this lagoon in 1955, which had no equivalence in other estuarine systems in southern Mexico. The species involved did not exhibit range-wide population reductions either. Most likely, this reduction was caused by man deriving the greatest part of fresh water from the Ayuquila-Armería watershed for human use, mostly agriculture, causing the loss or deterioration of ecological processes in the lagoon. The role of freshwater supply to Laguna Cuyutlán has been neglected by researchers and managers alike, while, conversely, they supported the opening of the lagoon to the sea. The effects of freshwater flow into Laguna Cuyutlán, as well as the supposed benefit of artificial connections with the sea, should be examined much more thoroughly, to provide sounder management actions for the conservation or restoration of the lagoon's ecological characteristics. Accepted 30 January 2009. © The Neotropical Ornithological Society.","Article","Scopus",0.598106501387287,NA,1,NA,NA,15,58,NA
"24","2-s2.0-76349088056",22,22,"Alexandre C.V., Esteves K.E., de Moura e Mello M.A.M.","35316869500;6603073670;35317436300;","Analysis of fish communities along a rural-urban gradient in a neotropical stream (Piracicaba River Basin, São Paulo, Brazil)",2010,"Hydrobiologia","10.1007/s10750-009-0060-y","https://www.scopus.com/inward/record.uri?eid=2-s2.0-76349088056&doi=10.1007%2fs10750-009-0060-y&partnerID=40&md5=0793147d4aae7f5cb4025ad068373648","This study investigated the fish fauna of a stream in southeastern Brazil that runs through sugar cane-growing and urban areas that are subject to sewage discharge. It aimed to determine the importance of spatial and environmental factors on fish distributions and to assess the use of fish as indicators of the environmental conditions. A longitudinal pattern of chemical water quality was observed, with more disturbed conditions at the urban sites. Several opportunistic or tolerant and omnivorous species such as Astyanax altiparanae, Poecilia reticulata, and Astyanax fasciatus were numerically abundant at these urban sites, which resulted in a consistent increase in species density and biomass along the stream. Redundancy analysis extracted three axes, identifying a nutrient-productivity gradient associated with different species composition patterns, as also detected by the indicator species analysis. No species could be considered a potential indicator of the agricultural area in the dry season, whereas four different species were judged potential indicators of three urban sites. In order to explain species distribution, variation in species abundance was partitioned into spatial and environmental components. The latter was more important, explaining 25.4% of the variation. We concluded that the fish assemblage of the Guamium stream is undergoing the initial stages of disturbance, with pronounced effects at the urbanized area, but no detectable changes at the sugar cane sites. Therefore, fish assemblages might be used as ecological indicators to detect urban impacts in similar rivers. However, the potential use of fish to diagnose stressors in areas of sugar cane plantations should be complementary to more comprehensive studies aimed at understanding the influence of this crop on freshwater resources. © 2010 Springer Science+Business Media B.V.","Article","Scopus",0.521331119959406,0,NA,NA,15,NA,23,NA
"25","2-s2.0-77957283700",21,21,"Maltchik L., Stenert C., Kotzian C.B., Pires M.M.","6603163555;8395391800;16028813600;36834027900;","Responses of odonate communities to environmental factors in southern Brazil wetlands",2010,"Journal of the Kansas Entomological Society","10.2317/JKES0910.13.1","https://www.scopus.com/inward/record.uri?eid=2-s2.0-77957283700&doi=10.2317%2fJKES0910.13.1&partnerID=40&md5=8c26b1e6258d74749a2ddc7ccdfdebf2","Odonate larvae play an important role in wetland systems, providing food for many fish species and birds. Besides, they are important predators in these ecosystems. However, studies of factors that determine odonate species richness and distribution in wetlands are scarce in the Neotropical region. The objectives of this study were to: 1) conduct a survey of the diversity of odonate larvae in southern Brazil wetlands, and 2) determine how much variation in odonate richness, abundance and composition is explained by wetland area, altitude, water conductivity and nitrate, hydroperiod, and dominant aquatic vegetation in 140 wetlands in an extensive area of the Neotropical region (∼280,000 km2, southern Brazil). A total of 4,039 individuals distributed among five families and 28 genera were collected. Libellulidae, Coenagrionidae and Aeshnidae were the families that showed the greatest richness. Erythrodiplax was observed in more than 70 of the sampled wetlands, and comprised 61 of individuals collected. Richness was negatively associated with wetland area and nitrate concentration. Odonate abundance was negatively associated with water conductivity and nitrate, and it was higher in aquatic beds than in emergent wetlands. Richness and abundance were higher in permanent than in intermittent wetlands. Variation in odonate composition was correlated with wetland altitude, area and water conductivity. Hydroperiod and dominant aquatic vegetation also influenced composition. Our results showed that southern Brazil wetlands are important habitats for 28 odonate genera, and that richness, abundance and composition are influenced mainly by hydroperiod, nitrate, and aquatic vegetation type. These results should be seen as important to determine the environmental factors that shape and maintain odonate diversity in southern Brazil wetlands. © 2010 Kansas Entomological Society.","Review","Scopus",0.488313137270403,0,NA,NA,15,NA,22,NA
"26","2-s2.0-79955526453",18,18,"Chaichana R., Pouangcharean S., Yoonphand R.","35766295700;37114001800;37113955100;","Habitat, abundance and diet of invasive suckermouth armored catfish (Loricariidae Pterygoplichthys) in the Nong Yai Canal, East Thailand",2011,"Tropical Zoology",NA,"https://www.scopus.com/inward/record.uri?eid=2-s2.0-79955526453&partnerID=40&md5=a6d95afeafc657d68afaf0ae36973565","Invasive non-indigenous aquatic flora and fauna have become increasingly common in Thailand, threatening the country's ecosystems and biological resources. A species of Neotropical suckermouth armored catfish (family Loricariidae), tentatively identified as the Amazon sailfin catfish Pterygoplichthys pardalis Castelnau 1855, is established in Thailand where it is becoming increasingly widespread and abundant. In March 2008, the local and national news reported that thousands of Pterygoplichthys were present in the Nong Yai Canal in eastern Thailand. Their report prompted us to investigate the abundance, diet, and habitat of this invasive species. Field sampling revealed that the average density Pterygoplichthys in the canal was 88 ± 93 individuals/100 m2. They were most abundant in the heavily urban downstream region of the canal. Over 70% of the total number of fishes taken in beach seine samples were Pterygoplichthys. The remaining 30% was a mix of native and non-native fish species. Linear regression of the abundance data indicates that native fishes will further decline and may eventually disappear in sites where Pterygoplichthys become established. Pterygoplichthys are known to thrive in disturbed habitats and the corresponding decline of natives in our study area may be the result interactions with the invasive fish or perhaps simply a reflection of their intolerance to a habitat that has become increasingly degraded (hyper-eutrophic). The existing canal has poor water quality as indicated by low dissolved oxygen levels (2.7 ± 2.1 mgL-1), and excessive concentrations of total phosphorus (3.8 ± 1.9 mgL -1), nitrogen (14 ± 2.8 mgL-1) and organic carbon (8.8 ± 2.6 mgL-1). Effective management and control of wild populations of Pterygoplichthys are urgently needed, before this species spreads further in Thailand.","Article","Scopus",0.643471805503279,0,0,NA,15,10,19,NA
"27","2-s2.0-80054948869",51,51,"Gil-Weir K., Weir E., Casler C.L., Aniyar S.","53877283200;53878853200;6603013356;6505796624;","Ecological functions and economic value of the Neotropic Cormorant (Phalacrocorax brasilianus) in Los Olivitos Estuary, Venezuela",2011,"Environment and Development Economics","10.1017/S1355770X11000179","https://www.scopus.com/inward/record.uri?eid=2-s2.0-80054948869&doi=10.1017%2fS1355770X11000179&partnerID=40&md5=fff3aaf799ee05e0e9de899cdfbf2153","We present the ecological functions of cormorants and estimate the economic value of these functions to artisanal fishermen, as a valuation exercise for Neotropic Cormorants at Los Olivitos Estuary, Lake Maracaibo, Venezuela. Ecological functions were based on estimating the abundance, distribution and diet of cormorants; economic values were attached to a selection of goods, services and attributes. Based on available information, we selected four ecological-economic functions of cormorants: harvesting for food; contributors to fish diversity; indicators of fish schools; and contributors to fish biomass, due to guano production. Cormorants consumed nine commercial fish species. Mean consumption was 225 g/ind/day. All ecological-economic functions were positive except for the role as contributors to fish biomass. Total value of the cormorant population to fishermen was $5,429,703/year. Unlike many studies, our results show that Neotropic Cormorants have a negligible impact on artisanal fisheries. We emphasize the importance of these results for management policies. © Cambridge University Press 2011.","Article","Scopus",0.474803926876149,NA,NA,NA,NA,NA,52,NA
"28","2-s2.0-84856706627",39,39,"Rodríguez-Olarte D., Taphorn D.C., Lobón-Cerviá J.","16022951500;6602312440;55931951900;","Do protected areas conserve neotropical freshwater fishes? A case study of a biogeographic province in Venezuela [¿Las áreas protegidas conservan los peces continentales neotropicales? un caso de estudio para una provincia biogeográfica en Venezuela]",2011,"Animal Biodiversity and Conservation",NA,"https://www.scopus.com/inward/record.uri?eid=2-s2.0-84856706627&partnerID=40&md5=14d732e03dc9819c171fbc1e9d347122","The effectiveness of protected areas to conserve freshwater fishes is limited because these areas are not usually congruent with regional patterns of fish species richness and distribution. We compared the richness, distribution and abundance of coastal freshwater fishes in a biogeographic province of Venezuela to determine their conservation status. We also estimated the relevance of existing protected areas in conserving fishes in different physiographic units and tributaries by evaluating species richness and distribution. The ichthyofauna (72 spp., ~30% endemic, ~10% threatened) was distributed according to orography, drainage and physiographic units. Most protected areas had limited effectiveness for fish conservation, mainly because they were too small or included only fragments of tributaries or drainages, or because they were located only in highland drainages where species diversity was minimal. To adequately protect freshwater fishes in this province the existing protected areas should be modified and expanded. © 2011 Museu de Ciències Naturals de Barcelona.","Article","Scopus",0.644460526830668,NA,0,NA,NA,10,40,NA
"29","2-s2.0-84856763266",0,0,"Guevara E.A., Santander G.T., Mueces T., Terán K., Henry P.-Y.","14035636600;55956682700;54960951500;54960951400;7401570512;","Population growth and seasonal abundance of the neotropic cormorant (Phalacrocorax brasilianus) at Highland Lakes in Ecuador",2011,"Waterbirds","10.1675/063.034.0413","https://www.scopus.com/inward/record.uri?eid=2-s2.0-84856763266&doi=10.1675%2f063.034.0413&partnerID=40&md5=e72a14af2ce824509066c69d63e65de7","Population growth of piscivorous species raises concerns when it could affect aquaculture activities. In this study, an increase of the Neotropic Cormorant (Phalacrocorax brasilianus) population in the Ecuadorian Andes was documented using census data from three high Andean lakes (Yahuarcocha, San Pablo and Yambo) for 2004-2010. In the 20th Century, only one record of the species existed for the study area. From 2005 onward, the species occurred regularly at all three lakes. At Yahuarcocha, the wintering population (OctoberFebruary) grew at an annual rate of 0.382 ± 0.05, reaching 307 in 2010. The population consists mainly of non-breeding migrants, and at the present time, the wintering distribution range of cormorant populations in Ecuador includes the high Andes. Given reports of cormorant predation at fish farms, potential conflicts on account of cormorant expansion are discussed.","Article","Scopus",0.770604188514128,1,1,NA,5,5,1,NA
"30","2-s2.0-84860716859",53,53,"Pompeu P.S., Agostinho A.A., Pelicice F.M.","13611334700;8614711600;14042332200;","Existing and future challenges: The concept of successful fish passage in South America",2012,"River Research and Applications","10.1002/rra.1557","https://www.scopus.com/inward/record.uri?eid=2-s2.0-84860716859&doi=10.1002%2frra.1557&partnerID=40&md5=b1808f442fcc57c041e5062113cf3c64","Most of the large rivers of South America are impounded mainly for hydropower production. The construction of fish passes has been one of the strategies adopted by Brazilian authorities and the energy sector to diminish the effects of these barriers on migratory fish communities. Despite the high investments and efforts involved, most facilities have been considered ineffective for conservation purposes. Decades of poor monitoring and the lack of specific studies have limited our knowledge on the real role of fish passes. Efficiency has been frequently defined as the proportion of fish that ascend a fish passage facility, compared to the shoal size that reaches the dam. Inspired by the notion that fishes accumulated below the dam need to migrate upstream, the quantity of fish passed upstream historically indicated successful management, as generally inferred by the fish abundance inside the fish pass. We propose a new concept for estimating fish pass efficiency for South American rivers, based on the capability of the fish pass to maintain viable populations. This broader approach is necessary because knowledge of fish habitats below and above the pass, plus the feasibility of downstream movements of eggs, larvae and adults through the reservoir and past the dam, is needed for assessing whether a fish pass is working as a conservation tool. © 2011 John Wiley & Sons, Ltd.","Article","Scopus",0.638545026485875,NA,0,NA,NA,10,54,NA
"31","2-s2.0-84865441659",1,1,"de Moura P.M., Vieira J.P., Garcia A.M.","55245880600;7202313237;7404609350;","Fish abundance and species richness across an estuarine-freshwater ecosystem in the Neotropics",2012,"Hydrobiologia","10.1007/s10750-012-1187-9","https://www.scopus.com/inward/record.uri?eid=2-s2.0-84865441659&doi=10.1007%2fs10750-012-1187-9&partnerID=40&md5=80174e9702b1148d4ae89985e86138c3","We investigated the distributional patterns of shallow-water fish and their environmental correlates along a broad spatial scale encompassing estuarine and freshwater ecosystems. Marine-vagrant species were restricted to the sites under the influence of salinity intrusion, whereas estuarine-related and freshwater guilds were found along the entire estuarine-freshwater gradient. Primary- and secondary-freshwater fish guilds had the most widespread spatial distribution and comprised a major fraction of the total abundance and species richness. Abiotic factors correlated with fish abundance and composition along two main environmental axes, one related with variation in salinity, water transparency, and sediment granulometry and the other with the slope gradient. Species richness was significantly higher at the natural channel linking the estuarine- and freshwater-ecosystem, which probably was due to: (a) a steeper slope that favored the confluence of fish from the littoral (<2 m) and limnetic (>2 m) zones and (b) the sporadic inflow of saltwater that carried into this region several marine-related species. Although estuarine-freshwater ecotones are known to support few species, mainly salinity tolerant, our results suggest that habitat features and seasonal fish movement associated with salinity intrusion could lead to more diverse fish assemblages in this transitional zone. © 2012 Springer Science+Business Media B.V.","Article","Scopus",0.50755477522668,0,NA,NA,5,NA,2,NA
"32","2-s2.0-84866022248",20,20,"Da Fonseca M.C.G., De São Clemente S.C., Felizardo N.N., Gomes D.C., Knoff M.","23990041900;6506303264;24479481600;35495221500;6603490600;","Trypanorhyncha cestodes of hygienic-sanitary importance infecting flounders Paralichthys patagonicus Jordan, 1889 and Xystreurys rasile (Jordan, 1891) of the Neotropical region, Brazil",2012,"Parasitology Research","10.1007/s00436-012-2912-z","https://www.scopus.com/inward/record.uri?eid=2-s2.0-84866022248&doi=10.1007%2fs00436-012-2912-z&partnerID=40&md5=a6f44876de975ac729fb15013aea83e2","From February 2007 to July 2010, 27 specimens of Paralichthys patagonicus, and from September to December 2010, 30 specimens of Xystreurys rasile were purchased from fish markets in the municipalities of Cabo Frio and Rio de Janeiro, State of Rio de Janeiro, Brazil. The fishes were measured, necropsied, filleted, and further had their organs investigated. In P. patagonicus, 19 (70, 3 %) were parasitized with metacestodes of Trypanorhyncha species: Nybelinia erythraea, N. lingualis, Heteronybelinia nipponica, Pterobothrium crassicolle, Grillotia carvajalregorum, and Callitetrahynchus gracilis. In X. rasile, 17 (56, 6 %) were parasitized with metacestodes: N. erythraea, N. lingualis, H. nipponica, and G. carvajalregorum. The parasitological indices of prevalence, intensity, mean intensity, abundance, mean abundance, range of infection, and infection sites of each parasite species are presented. This is the first report of Trypanorhyncha cestodes parasitizing specimens of P. patagonicus and X. rasile. These cestodes were studied due to their importance during fish sanitary inspection, if one considers the harm that the repulsive aspect of infected meat causes to consumers. © Springer-Verlag 2012.","Article","Scopus",0.449999564108608,0,NA,NA,15,NA,21,NA
"33","2-s2.0-84866630086",13,13,"Barili E., Fugi R., Novakowski G.C., Agostinho A.A.","57194423742;6506967985;6504562109;8614711600;","Impoundment effects in the population of Auchenipterus osteomystax (Siluriformes: Auchenipteridae): A Neotropical reservoir case",2012,"Revista de Biologia Tropical",NA,"https://www.scopus.com/inward/record.uri?eid=2-s2.0-84866630086&partnerID=40&md5=5daaf8e0f83129876ace15381f6c9fdb","New impoundments provide opportunities to check whether species that present enough feeding flexibility in natural conditions may take advantage of this situation and, without reproductive restriction, can occupy the most conspicuous habitat in a large reservoir (open areas) and present higher success in the colonization of the new environment. We examined variations in the abundance and feeding of A. osteomystax in two environments, one natural (Sinhá Mariana floodplain lake) and one dammed (Manso Reservoir), during two periods: the first year after the filling phase and three years later. Our goal was to evaluate the occupation of the new habitat (Manso Reservoir), by this species, as well as to test the hypothesis that in the reservoir, unlike the natural environment, there are remarkable changes in diet between the periods. Fish were sampled monthly in the floodplain lake and in the reservoir during two annual periods using gillnets. To evaluate the differences in abundance of A. osteomystax we employed the Kruskal -Wallis test, and the diet analysis was carried out using frequency of occurrence and volumetric methods. Temporal differences in the diet were tested by Kruskal-Wallis test using the scores from a detrended correspondence analysis. A. osteomystax was significantly more abundant in the floodplain lake, where the captures were higher than in the reservoir in almost all months analyzed, and significant variations in abundance between the two periods were not recorded in either the reservoir or the floodplain lake. The diet variation between the two periods, which had a time lag of three years between them, was much less pronounced in the natural environment, where the resource availability is essentially regulated by seasonality. Thus, our hypothesis was accepted; that is, the interannual variations in the diet of A. osteomystax are more relevant in an artificial environment than in a natural one.","Article","Scopus",0.593132850491681,1,1,"effect of damns",10,15,14,NA
