,EID,X__1,Unnamed: 0,Authors,Author(s) ID,Title,Year,Source title,DOI,Link,Abstract,Document Type,Source,p,Relevance_std,Relevance_ranked,X__2,Timespan_std,Timespan_ranked,Relevance_std_mod,Timespan_std_mod,Scopus_index,Present_in_training_docs
171,2-s2.0-85051010672,57,57,"Li B., Cao J., Guan L., Mazur M., Chen Y., Wahle R.A.",56925679600;36709421800;57192175418;57203243560;35263790500;6701846771;,Estimating spatial non-stationary environmental effects on the distribution of species: A case study from American lobster in the Gulf of Maine,2018,ICES Journal of Marine Science,10.1093/icesjms/fsy024,https://www.scopus.com/inward/record.uri?eid=2-s2.0-85051010672&doi=10.1093%2ficesjms%2ffsy024&partnerID=40&md5=078ebd9873a830d3f802235b00c1f7f5,"Estimating spatial distribution of a species is traditionally achieved using global regression models with the assumption of spatial stationarity of relationships between species and environmental variables. However, species abundance and environmental variables are often spatially correlated and the strength of environmental effects may exhibit spatial non-stationarity on the species distribution. We applied local models, such as season-, sex-, and size-specific geographically weighted regression (GWR) models, on American lobster to explore non-stationary environmental effects on the presence and density of lobsters in the inshore Gulf of Maine (GOM). This species and its fishery have undergone a dramatic increase in abundance over the past two decades. Model results showed that the strength of the estimated relationships in the western GOM were different with the relationships in the eastern GOM during 2000-2014. Bottom water temperature had a more significant positive impact on the increase of lobsters in the eastern GOM, while the influence of temperature was less significant in the west and the more distinguishable drivers of distribution needed to be identified. The estimation of locally varied relationships can further improve regionally informed management plans. The modeling approach can be widely applied to many other species or study areas. © International Council for the Exploration of the Sea 2018. All rights reserved.",Article,Scopus,0.570874053,NA,NA,NA,NA,NA,,,58,NA
25,2-s2.0-0033507892,171,171,"Lovrich G.A., Vinuesa J.H.",6701915253;6602193043;,"Reproductive potential of the lithodids Lithodes santolla and Paralomis granulosa (Anomura, Decapoda) in the Beagle Channel, Argentina",1999,Scientia Marina,NA,https://www.scopus.com/inward/record.uri?eid=2-s2.0-0033507892&partnerID=40&md5=8c3133c81280e547d85fc058879ec502,"Lithodidae is the only group of reptant decapods that occurs in Antarctic waters and has been particularly abundant in the Beagle Channel, Straits of Magellan and south to 50°S. Because of their abundance in coastal waters, the sympatric Lithodes santolla and Paralomis granulosa have constituted a mixed fishery since the 1930s. The two species differ markedly in their reproductive potential. Lithodes santolla is large (maximum size of 190 mm carapace length, CL, and 8 kg weight), has a generation time of 6 yrs., the reproductive cycle is annual and females carry between 5,000-60,000 eggs per female per clutch. In their life span, L. santolla females produce 6 times more eggs than P. granulosa females. Paralomis granulosa is smaller than its relative (maximum 115 mm CL and 1.5 kg weight), and has a slower growth rate, resulting in a generation time of 12 yrs. The reproductive cycle is biennial and females carry between 800-10,000 eggs per female per clutch. Moreover, the reproductive potential of P. granulosa is reduced because an important proportion of the largest and more prolific females of the population do not carry eggs. In other terms, in one generation time of P. granulosa, two complete generations of L. santolla are produced, and compared to other Subantarctic lithodids L. santolla is the most prolific species. The higher reproductive potential of L. santolla probably confers to this species the ability to recover more rapidly from an overfishing situation.",Conference Paper,Scopus,0.570415595,NA,NA,NA,NA,NA,,,172,NA
81,2-s2.0-77956194647,148,148,"Raymond B., Shaffer S.A., Sokolov S., Woehler E.J., Costa D.P., Einoder L., Hindell M., Hosie G., Pinkerton M., Sagar P.M., Scott D., Smith A., Thompson D.R., Vertigan C., Weimerskirch H.",35307743400;35263052300;7202853712;55895022100;24346625300;14035554600;7003704772;7004432729;7003793212;7102936664;14322157300;55740280000;55316299800;36199040200;56213156300;,Shearwater foraging in the Southern Ocean: The roles of prey availability and winds,2010,PLoS ONE,10.1371/journal.pone.0010960,https://www.scopus.com/inward/record.uri?eid=2-s2.0-77956194647&doi=10.1371%2fjournal.pone.0010960&partnerID=40&md5=75a19e484d3068e40033d0589bb3da5b,"Background: Sooty (Puffinus griseus) and short-tailed (P. tenuirostris) shearwaters are abundant seabirds that range widely across global oceans. Understanding the foraging ecology of these species in the Southern Ocean is important for monitoring and ecosystem conservation and management. Methodology/Principal Findings: Tracking data from sooty and short-tailed shearwaters from three regions of New Zealand and Australia were combined with at-sea observations of shearwaters in the Southern Ocean, physical oceanography, nearsurface copepod distributions, pelagic trawl data, and synoptic near-surface winds. Shearwaters from all three regions foraged in the Polar Front zone, and showed particular overlap in the region around 140°E. Short-tailed shearwaters from South Australia also foraged in Antarctic waters south of the Polar Front. The spatial distribution of shearwater foraging effort in the Polar Front zone was matched by patterns in large-scale upwelling, primary production, and abundances of copepods and myctophid fish. Oceanic winds were found to be broad determinants of foraging distribution, and of the flight paths taken by the birds on long foraging trips to Antarctic waters. Conclusions/Significance: The shearwaters displayed foraging site fidelity and overlap of foraging habitat between species and populations that may enhance their utility as indicators of Southern Ocean ecosystems. The results highlight the importance of upwellings due to interactions of the Antarctic Circumpolar Current with large-scale bottom topography, and the corresponding localised increases in the productivity of the Polar Front ecosystem. © 2010 Raymond et al.",Article,Scopus,0.569686661,NA,NA,NA,NA,NA,,,149,NA
28,2-s2.0-0034130605,41,41,"Hewitt R.P., Demer D.A.",7102286548;6701577823;,"The use of acoustic sampling to estimate the dispersion and abundance of euphausiids, with an emphasis on Antarctic krill, Euphausia superba",2000,Fisheries Research,10.1016/S0165-7836(00)00171-5,https://www.scopus.com/inward/record.uri?eid=2-s2.0-0034130605&doi=10.1016%2fS0165-7836%2800%2900171-5&partnerID=40&md5=efecac0365f1526d9932e4d9246e7a57,"Acoustic sampling has been used to investigate the ecology of Antarctic krill (Euphausia superba) and to provide information on dispersion and abundance necessary to manage their harvest. Population estimates based on multi-ship acoustic surveys have been used to set catch limits. More localized acoustic surveys have been conducted to study the response of land-breeding krill predators to local variations in their food-supply. These and future surveys may result in addition controls on the fishery. In this context, the use of acoustics to survey euphausiids is reviewed and major sources of uncertainty are discussed. These issues are organized as they pertain to the two broad steps of acoustic surveys: (1) estimating the volumetric density of krill (measurement uncertainty) and (2) mapping krill distribution and estimating abundance (sampling uncertainty).",Article,Scopus,0.568330416,NA,NA,NA,NA,NA,,,42,NA
18,2-s2.0-0029094692,137,137,"Rohde K., Hayward C., Heap M.",7102130011;7103041740;7007063022;,Aspects of the ecology of metazoan ectoparasites of marine fishes,1995,International Journal for Parasitology,10.1016/0020-7519(95)00015-T,https://www.scopus.com/inward/record.uri?eid=2-s2.0-0029094692&doi=10.1016%2f0020-7519%2895%2900015-T&partnerID=40&md5=f4885c866c628736ede5e0bcb6cee27e,"Numerous (3947) individuals of 102 marine fish species from Papua New Guinea, New Zealand, the North Sea, Antarctica, the deepsea and coast of southeastern Australia, Pacific Canada, Brazil, Argentina and the Great Barrier Reef were examined for metazoan ecteparasites. Of the 102 fish species, 86 harboured at least 1 parasite species, and only in Antarctica and the deepsea were large proportions of fish species found to be free of ectoparasites. The mean prevalence of infection was 30.1%, the average of abundances was 6.7 parasites per fish, due to very heavy intensities of some parasite species (mean median abundance 4.31). Most parasite species exhibited a clustered distribution in the host populations, as measured by variance to mean raties, i.e. some fish were more, and others less, heavily infected than if infection were random. Core and satellite species cannot be distinguished unambiguously, because numbers of parasites on almost all hosts are too small for any bimodality to become apparent. On average, the most dominant species represeated 90% of all parasite individuals of a particular fish; different parasite species were often dominant on different fish individuals of a particular host species. Both abundances and maximum intensities of infection were positively correlsted with prevalence of infection. Community richness varies greatly at and between localities, with the lewest richness found in Antarctic and deepsea fish and the highest richness in tropical fish. Species richness, abundance and prevalence of infection.in many fish groups (with different ecological characteristics) are strongly correlated with temperature. If fish from all localities were pooled, pelagic fish had fewer intensites and (jointly with benthopelagic fishes) fewer species than benthic fish, and planktivorous fish had lower abundances and prevalences of infection than predatory and omnivorous fish. Prevalences of infection, abundance and parasite species richness were significantly correlated with host length. Fifteen positive and 1 negative anaciations among species were found. This and the generally low prevalences and abundances of infection indicate that competitive interactions are probably scarce. Overall, the findings indicate that most (if not all) metazoan ectoparasite communities of marine fish live in non-saturated, little-ordered assemblages. © 1995.",Article,Scopus,0.5682966,NA,NA,NA,NA,NA,,,138,NA
128,2-s2.0-84897612658,60,60,"Jaquemet S., Ternon J.F., Kaehler S., Thiebot J.B., Dyer B., Bemanaja E., Marteau C., Le Corre M.",6508312444;6603186931;7004262046;35199127600;7006602012;36086051100;56734299900;7003495178;,Contrasted structuring effects of mesoscale features on the seabird community in the Mozambique Channel,2014,Deep-Sea Research Part II: Topical Studies in Oceanography,10.1016/j.dsr2.2013.10.027,https://www.scopus.com/inward/record.uri?eid=2-s2.0-84897612658&doi=10.1016%2fj.dsr2.2013.10.027&partnerID=40&md5=8952485b279db2d8cf94e86a25e32f5c,"The Mozambique Channel (western Indian Ocean) is a dynamic environment characterised by strong mesoscale features, which influence all biological components of the pelagic ecosystem. We investigated the distribution, abundance and feeding behaviour of seabirds in the Mozambique Channel in relation to physical and biological environmental variables, with a specific interest in mesoscale features. Seabird censuses were conducted in summer and winter during 7 cruises in the southern and northern Mozambique Channel. Tropical species accounted for 49% of the 37 species identified and 97% of the individuals, and species from the sub-Antarctic region constituted 30% of the identifications. The typically tropical sooty tern (Onychoprion fuscata) was the dominant species during all cruises, and overall accounted for 74% of the species observations and 85% of counted birds. Outputs of Generalised Linear Models at the scale of the Mozambique Channel suggested that higher densities of flying and feeding birds occurred in areas with lower sea surface temperatures and lower surface chlorophyll a concentrations. Most of the flocks of feeding birds did not associate with surface schools of fish or marine mammals, but when they did, these flocks were larger, especially when associated with tuna. While tropical species seemed to favour cyclonic eddies, frontal and divergence zones, non-tropical species were more frequently recorded over shelf waters. Sooty terns foraged preferentially in cyclonic eddies where zooplankton, micronekton and tuna schools were abundant. Among other major tropical species, frigatebirds (Fregata spp.) predominated in frontal zones between eddies, where tuna schools also frequently occurred and where geostrophic currents were the strongest. Red-footed boobies (Sula sula) concentrated in divergence zones characterised by low sea level anomalies, low geostrophic currents, and high zooplankton biomass close to the surface. Our results highlight the importance of mescoscale features in structuring the tropical seabird community in the Mozambique Channel, in addition to segregating tropical and non-tropical species. The mechanisms underlying the segregation of tropical seabirds seem to partially differ from that of other tropical regions, and this may be a consequence of the strong local mesoscale activity, affecting prey size and availability schemes. Beyond characterising the foraging habitats of the seabird community of the Mozambique Channel, this study highlights the importance of this region as a hot spot for seabirds; especially the southern part, where several endangered sub-Antarctic species over-winter. © 2013 Elsevier Ltd.",Article,Scopus,0.566237441,NA,NA,NA,NA,NA,,,61,NA
59,2-s2.0-44649142525,130,130,"Reiss C.S., Cossio A.M., Loeb V., Demer D.A.",7101708474;24337668800;7003467173;6701577823;,"Variations in the biomass of Antarctic krill (Euphausia superba) around the South Shetland Islands, 1996-2006",2008,ICES Journal of Marine Science,10.1093/icesjms/fsn033,https://www.scopus.com/inward/record.uri?eid=2-s2.0-44649142525&doi=10.1093%2ficesjms%2ffsn033&partnerID=40&md5=3f94228d59afb8ccd9d4dd70b2ff2ae6,"The time-series of acoustically surveyed Antarctic krill (Euphausia superba) biomass near the South Shetland Islands (SSI) between 1996 and 2006 is re-estimated using a validated physics-based model of target strength (TS), and a species-discrimination algorithm based on the length-range of krill in plankton samples to identify krill acoustically, derived from TS-model predictions. The SSI area is surveyed each austral summer by the US Antarctic Marine Living Resources Program, and the acoustic data are used to examine trends in krill biomass and to assess the potential impact of fishing to the reproductive success of land-based predators (seals and penguins). The time-series of recomputed biomass densities varies greatly from that computed using an empirical log-linear TS-model and fixed-ranges of differences in volume-backscattering strengths (ΔSv), conventionally used to identify krill acoustically. The new acoustic estimates of biomass are significantly correlated with both proportional recruitment and krill abundance estimated from zooplankton samples. Two distinct peaks in biomass (1996 and 2003) are in accord with recruitment events shown by net-based krill time-series. The foundation for the new TS-model and the associated krill-discrimination algorithm, coupled with the agreement between acoustic- and net-survey results, provides strong support for the use of the new analytical technique. Variable biases in the re-estimated krill biomass have been greatly reduced. However, survey variability increased as a result of the increased rejection of acoustic backscatter previously attributed to krill. Management of Southern Ocean krill stocks based on a precautionary approach may therefore result in decreased allocations of krill, given its dependence on the variability of survey estimates. © 2008 US Government and the Department of Commerce/National Oceanic and Atmospheric Administration/National Marine Fisheries Service/Southwest Fisheries Science Center.",Article,Scopus,0.558464709,NA,NA,NA,NA,NA,,,131,NA
3,2-s2.0-0001553657,149,149,"Hewitt R.P., Linen Low E.H.",7102286548;8770197700;,The Fishery on Antarctic Krill: Defining an Ecosystem Approach to Management,2000,Reviews in Fisheries Science,10.1080/10641260091129224,https://www.scopus.com/inward/record.uri?eid=2-s2.0-0001553657&doi=10.1080%2f10641260091129224&partnerID=40&md5=c9c4264fe3bcdc2c7e457942a22f61cf,"Estimates of the standing stock of Antarctic krill (Euphausia superba) have ranged from less than 100 million tons to over a billion tons. While considerable uncertainty is associated with these estimates, the fishery on Antarctic krill has the potential to be among the largest in the world. The harvest of Antarctic krill is currently managed by the Convention for the Conservation of Antarctic Marine Living Resources (CCAMLR), part of the Antarctic Treaty system. In this review, we examine the political context and management approach of CCAMLR; we review the current understanding of natural controls on population growth of the resource; and we discuss future options for CCAMLR. We conclude that the political foundation for the CCAMLR mandate of an ""ecosystem approach to management"" is sound; that substantial progress has been made toward interpreting and implementing the Convention; and that environmental factors may exert a substantial influence on krill recruitment and population growth. We also note that the current fishery in the southwest Atlantic sector of the Southern Ocean (ca. 100,000 tons per year) is small compared with the precautionary limit established for this area by CCAMLR (1,500,000 tons per year), but fishing effort concentrated near colonies of land-breeding krill predators may pose a threat; that improvements to the current krill yield model are warranted; and that uncertainty regarding the character of natural variability in krill abundance and regarding the future development of the krill fishery act to obscure a strategic vision for CCAMLR. We discuss the likelihood of future scenarios and the appropriate options for CCAMLR, and we suggest a general outline for the development of a management scheme based on ecosystem process monitoring. We conclude with a comment regarding the value of a conservation ethic in the face of uncertainty.",Article,Scopus,0.555084727,NA,NA,NA,NA,NA,,,150,NA
58,2-s2.0-40549119554,70,70,"Reid K., Croxall J.P., Murphy E.J.",7202780677;7004527404;7401684007;,The power of ecosystem monitoring,2007,Aquatic Conservation: Marine and Freshwater Ecosystems,10.1002/aqc.909,https://www.scopus.com/inward/record.uri?eid=2-s2.0-40549119554&doi=10.1002%2faqc.909&partnerID=40&md5=03e3d8fec67bb419b0a1ec51f19b4eef,"1. Implementing an ecosystem approach to fisheries management requires an effective ecosystem monitoring programme, the utility of which depends upon its ability (measured by the statistical power) to detect effects that trigger management action. 2. Using data from a long-term ecosystem monitoring programme of the predators of Antarctic krill Euphausia superba at South Georgia together with a krill population model to simulate natural and fisheries induced variability in krill abundance, the power to detect the effects of different levels of fishing was examined. 3. The power to detect the effects of fishing using either the krill population or a combined predator response index was low (20-40% power after 20 years with the probability of a type I error (α) = 0.05). The power increased to > 50% when α was increased to 0.2 when the ability to detect change was greater with the predator response index than using the krill population itself. 4. The results indicate that although this monitoring programme has a proven ability to detect the effects of natural variability in krill abundance, its ability to detect the effects of fishing may be limited if there is a requirement for statistical significance at the 95% level. A situation where changing α produces a marked increase in statistical power, and the difference in the relative ecological costs of making type I and type II errors is likely to be high, may require a more flexible approach to choosing significance levels required to trigger management action. 5. Although long-term monitoring provides a wealth of basic ecological information it is essential to evaluate, the ability to detect specific changes in order that management action is not delayed because of an inability to detect an effect rather than the lack of an effect of the fishery. Copyright © 2008 John Wiley & Sons, Ltd.",Conference Paper,Scopus,0.548522692,NA,NA,NA,NA,NA,,,71,NA
135,2-s2.0-84920083013,154,154,"Pinkerton M.H., Bradford-Grieve J.M.",7003793212;6701457675;,"Characterizing foodweb structure to identify potential ecosystem effects of fishing in the Ross Sea, Antarctica",2014,ICES Journal of Marine Science,10.1093/icesjms/fst230,https://www.scopus.com/inward/record.uri?eid=2-s2.0-84920083013&doi=10.1093%2ficesjms%2ffst230&partnerID=40&md5=5f09cd24390ef1fb09c5c6401dc6792f,"The potential ecosystem effects of fishing for Antarctic toothfish (Dissostichus mawsoni) in the Ross Sea region were investigated. Mixed trophic impact analysis was applied to a model of the Ross Sea foodweb and used to calculate the relative trophic importances of species and trophic groups in the system. The trophic impact of toothfish on medium-sized demersal fish was identified as the strongest top-down interaction in the system based on multiple-step analysis. This suggests a potential for a strong predation-release effect on some piscine prey of toothfish (especially grenadiers and ice-fish on the Ross Sea slope). However, Antarctic toothfish had moderate trophic importance in the Ross Sea foodweb as a whole, and the analysis did not support the hypothesis that changes to toothfish will cascade through the ecosystem by simple trophic effects. Because of limitations of this kind of analysis, cascading effects on the Ross Sea ecosystem due to changes in the abundance of toothfish cannot be ruled out, but for such changes to occur a mechanism other than simple trophic interactions is likely to be involved. Trophic importances were highest in the middle of the foodweb where silverfish and krill are known to have a key role in ecosystem structure and function. The six groups with the highest indices of trophic importance were (in decreasing order): phytoplankton, mesozooplankton, Antarctic silverfish, small demersal fish, Antarctic krill and cephalopods. Crystal krill and small pelagic fish also had high trophic importance in some analyses. Strengths and limitations of this kind of analysis are presented. In particular, it is noted that the analysis only considers trophic interactions at the spatial, temporal and ecological scale of the whole Ross Sea shelf and slope area, averaged over a typical year and in 35 trophic groups. Interference and density-dependent effects were not included in this analysis. Effects at smaller spatial and temporal scales, and effects concerning only parts of populations, were not resolved by the analysis, and this is likely to underestimate the potential risks of fishing to Weddell seals and type-C killer whales. © International Council for the Exploration of the Sea 2014. All rights reserved.",Article,Scopus,0.54213354,NA,NA,NA,NA,NA,,,155,NA
