,EID,X__1,Unnamed: 0,Authors,Author(s) ID,Title,Year,Source title,DOI,Link,Abstract,Document Type,Source,p,Relevance_std,Relevance_ranked,X__2,Timespan_std,Timespan_ranked,Relevance_std_mod,Timespan_std_mod,Scopus_index,Present_in_training_docs
108,2-s2.0-84866035538,23,23,"Vacchi M., DeVries A.L., Evans C.W., Bottaro M., Ghigliotti L., Cutroneo L., Pisano E.",36930191000;7004771966;7403479974;12794107900;7801515564;36080500300;7007072196;,A nursery area for the Antarctic silverfish Pleuragramma antarcticum at Terra Nova Bay (Ross Sea): First estimate of distribution and abundance of eggs and larvae under the seasonal sea-ice,2012,Polar Biology,10.1007/s00300-012-1199-y,https://www.scopus.com/inward/record.uri?eid=2-s2.0-84866035538&doi=10.1007%2fs00300-012-1199-y&partnerID=40&md5=82959d5dde83978505fc298ffcf1e879,"Pleuragramma antarcticum is the dominant pelagic fish in the waters of the continental shelf in high Antarctic regions, where it plays a key role in the food web. A nursery ground for eggs of this species was first identified in 2002 in Terra Nova Bay (Ross Sea), where eggs were found trapped in ice platelets under the sea-ice during the spring. As part of a monitoring program aimed at understanding the geographic and temporal characteristics of this nursery ground, the present study reports on surveys carried out in the austral springs of 2005 and 2006 using a simple and effective method for sampling from the sea-ice. These surveys enabled the evaluation of the spatial range of the nursery area of the Antarctic silverfish in the sea-ice of the coastal area of Victoria Land between the Coulman Island and the Drygalski Glacier Tongue. P. antarcticum eggs were concentrated in an area of Terra Nova Bay of about 270 km 2, encompassing two adjacent sites, Gerlache Inlet and Silverfish Bay. The present results add information on life cycle and hatching period of the Antarctic silverfish and confirm the importance of the Terra Nova Bay as a nursery area for this important species. Moreover, the survey points to the sea-ice cover and platelet ice as important environmental features of the nursery area. © 2012 Springer-Verlag.",Article,Scopus,0.642374078,0,NA,Measures of egg and larval abundance reported,10,NA,0,10,24,NA
142,2-s2.0-84939895377,107,107,"Saunders R.A., Collins M.A., Ward P., Stowasser G., Shreeve R., Tarling G.A.",36723452800;7404083794;7402102122;57203673125;7004148142;6603871534;,"Distribution, population structure and trophodynamics of Southern Ocean Gymnoscopelus (Myctophidae) in the Scotia Sea",2015,Polar Biology,10.1007/s00300-014-1584-9,https://www.scopus.com/inward/record.uri?eid=2-s2.0-84939895377&doi=10.1007%2fs00300-014-1584-9&partnerID=40&md5=d8b24424a9c294f95ef6f4861dbfe6ef,"Gymnoscopelus braueri, Gymnoscopelus fraseri and Gymnoscopelus nicholsi are common in the Southern Ocean mesopelagic fish community. However, their ecology is poorly understood in the region. This study investigated spatial and temporal patterns in their abundance, population structure and diets at different times of year within the Scotia Sea to ascertain their functional role in the pelagic food web. G. braueri was the most abundant species (0.07–0.17 ind. 1,000 m−3) throughout the Scotia Sea. G. fraseri was absent from the sea-ice sectors and occurred mostly around the Antarctic Polar Front (APF), comprising densities of 0.01–0.04 ind. 1,000 m−3. G. nicholsi occurred in low abundance (&lt;0.01 ind. 1,000 m−3) throughout the region. G. braueri and G. fraseri had a lifespan of ~4 and 3 years, respectively, but spatial variation in their population structures was evident and recruitment appeared to occur only around the APF. G. nicholsi had a lifespan of &gt;4 years. There was evidence of seasonal variation in depth distribution, size-related sexual dimorphism and vertical segregation in size classes for each species. Overall, diets were dominated by copepods (Metridia spp., Rhincalanus gigas, Pleuromamma robusta) and euphausiids (Thysanoessa spp. and Euphausia superba), although G. fraseri did not predate E. superba. Regional, seasonal and ontogenetic patterns in diet were evident for all species. This study provides new insight into the ecology of these Gymnoscopelus species in the Scotia Sea. Such details contribute towards resolving how pelagic food webs are structured in the Southern Ocean and their sensitivity to ongoing environmental change. © 2014, Springer-Verlag Berlin Heidelberg.",Article,Scopus,0.639716552,NA,NA,NA,NA,NA,,,108,NA
2,2-s2.0-0000566818,71,71,"Nicol S., Constable A.J., Pauly T.",7103154776;7006372744;7005251792;,Estimates of circumpolar abundance of Antarctic krill based on recent acoustic density measurements,2000,CCAMLR Science,NA,https://www.scopus.com/inward/record.uri?eid=2-s2.0-0000566818&partnerID=40&md5=343f0ae8d24df9f36a76df7507d1e9ac,"The total circumpolar abundance of Antarctic krill (Euphausia superba) is estimated using recent measurements of krill density from acoustic surveys and historical information on the overall range of krill. The biomass estimates fall between 60 and 155 million tonnes -at the low end of values that have been suggested in the past. The differences between our estimates and others can be explained by a number of factors such as: an underestimation of the range or the acoustic biomass estimates; the possibility of a large, undetected krill population; and the overestimation of the demand for krill by predators. Even if these low krill biomass estimates are correct, regional and total precautionary limits are still likely to rise as a result of new surveys because the method used to calculate precautionary limits uses a value of 11% of the estimated pre-exploitation biomass. Additionally, the current precautionary catch limits in the South Atlantic are set using a superseded acoustic target strength which has effectively underestimated the krill biomass by a factor of three, so the new survey of the South Atlantic in January 2000 may result in an effective biomass which is greater than the value used in the past. The seasonal and local consequences of large catch limits will have to be taken into account when managing an expanded krill fishery, and the appropriateness of using the existing statistical divisions as management areas will have to be considered.",Article,Scopus,0.63748677,NA,NA,NA,NA,NA,,,72,NA
130,2-s2.0-84907344017,169,169,"Leitch T.N., Dann P., Arnould J.P.Y.",56367183700;7003858583;7007039027;,The diet of Pacific gulls (Larus pacificus) breeding at Seal Island in northern Bass Strait,2014,Australian Journal of Zoology,10.1071/ZO13066,https://www.scopus.com/inward/record.uri?eid=2-s2.0-84907344017&doi=10.1071%2fZO13066&partnerID=40&md5=acc9493df4609b659c3cba128a56d78c,"The endemic Pacific gull (Larus pacificus) is Australia's largest larid, and though little is currently known of its foraging ecology, its size and wide distribution suggest that it may play an important role within the marine environment. In the present study, regurgitate pellets collected from Seal Island in northern Bass Strait were used to compare intra- and interannual trends in diet composition. The main taxa identified in pellets were the common diving-petrel (Pelecanoides urinatrix), leatherjacket species (Family Monacanthidae), short-tailed shearwater (Puffinus tenuirostris) and mirror bush (Coprosma repens). Analysis of similarity (ANOSIM) identified no significant differences in numerical abundance of the dominant prey species between years, suggesting that the prey base in this region is temporally consistent or that the gulls consume low enough numbers to be unaffected by fluctuation in prey populations. Diving-petrels were consumed in consistently high numbers, suggesting the gulls may be an important predator of this species, or that the gulls are particularly skilled at foraging for them. © CSIRO 2014.",Article,Scopus,0.634959845,NA,NA,NA,NA,NA,,,170,NA
93,2-s2.0-80051607439,47,47,"Wiedenmann J., Cresswell K.A., Goldbogen J., Potvin J., Mangel M.",12769083000;20733656100;8206638400;7005182070;7006742732;,Exploring the effects of reductions in krill biomass in the Southern Ocean on blue whales using a state-dependent foraging model,2011,Ecological Modelling,10.1016/j.ecolmodel.2011.07.013,https://www.scopus.com/inward/record.uri?eid=2-s2.0-80051607439&doi=10.1016%2fj.ecolmodel.2011.07.013&partnerID=40&md5=4751953043d1602d1f0254c903dd0749,"Many species of baleen whales were hunted to near extinction in the Southern Hemisphere. The recovery of these populations will be affected by the availability of krill, a major dietary component, in the Southern Ocean. We combine a novel energetics model for baleen whales with a state dependent foraging model to explore the impacts of an expanding krill fishery on baleen whales. We parameterize the model for blue whales, but with simple modifications it could be applied to most baleen whales. We predict that an expanding fishery will have a small but significant impact on the blue whale population through decreased birth rates. However, spreading the catch limit throughout the range of krill can reduce these effects. In addition, whales may be able to reduce these impacts through adaptive changes in foraging behavior. The relationship between krill abundance and blue whale foraging and reproductive success is nonlinear, such that larger reductions in krill biomass, potentially following a loss of sea ice due to climate change, could have a much larger negative impact on the recovery of blue whales. © 2011 Elsevier B.V.",Article,Scopus,0.632375205,NA,NA,NA,NA,NA,,,48,NA
16,2-s2.0-0027084665,134,134,Zdzitowiecki K.,55955071700;,Acanthocephalan infection of inshore fish in two fjords at South Georgia,1992,Antarctic Science,10.1017/S0954102092000300,https://www.scopus.com/inward/record.uri?eid=2-s2.0-0027084665&doi=10.1017%2fS0954102092000300&partnerID=40&md5=daa0d93f9e13307677b235dcf2cbf01a,"An examination of 111 fish of eight species, including 92 immature Notothenia rossii Richardson revealed nine acanthocephalan species, including four Echinorhynchida occurring in the alimentary tract and five Polymorphida in the body cavity. Echinorhynchida were much more numerous (87% specimens of 4855 collected), especially Metacanthocephalus johnstoni Zdzitowiecki (the dominant species) and Aspersentis megarhynchus (Linstow). The Polymorphida parasites of seals (three species) were more abundant than species parasitic in birds (two species). Association of most of species, (except Corynosoma bullosum (Linstow) and Echinorhynchus spp.), with the inshore (fjord) environment was confirmed. The species diversity, prevalence and density of infection increased with the size of immature N. rossii. Differences in acanthocephalan occurrence and changes with time are related to differences in host distribution and abundance. For example, the occurrence of C. arctocephali in N. rossii at South Georgia is related to the increase of the für seal population. A list of acanthocephalans in fish at South Georgia and the South Shetland Islands (14 species in total) is included. © 1992, Antarctic Science Ltd. All rights reserved.",Article,Scopus,0.631593901,NA,NA,NA,NA,NA,,,135,NA
78,2-s2.0-77951978586,59,59,"Fujioka K., Hobday A.J., Kawabe R., Miyashita K., Honda K., Itoh T., Takao Y.",35745949900;6701910294;9336370200;7202708298;36145811700;7404746666;7101878181;,Interannual variation in summer habitat utilization by juvenile southern bluefin tuna (Thunnus maccoyii) in southern Western Australia,2010,Fisheries Oceanography,10.1111/j.1365-2419.2010.00536.x,https://www.scopus.com/inward/record.uri?eid=2-s2.0-77951978586&doi=10.1111%2fj.1365-2419.2010.00536.x&partnerID=40&md5=ae2e42d468b6f3a3e77e46d25efe858b,"The spatial habitat utilization of juvenile southern bluefin tuna in southern Western Australia was investigated using automated acoustic receivers with acoustic transmitters implanted in tagged fish during three austral summers (2004/2005, N = 79 fish, 2005/2006, N = 81, 2006/2007, N = 84). Seventy acoustic receivers were deployed at three cross-shelf lines and three coastal topographic features (lumps) between December and May. We observed markedly different patterns of habitat utilization between the three seasons: (i) aggregation at lumps in 2004/2005 and 2006/2007, and (ii) wide distribution over the continental shelf (i.e., few occurring at lumps) in 2005/2006. Vertical profile by conductivity-temperature-depth casts showed these spatial shifts were caused by interannual changes in the presence of sub-Antarctic water. The sub-Antarctic water was present in the subsurface layer close to the continental slope only during 2005/2006, and the area had higher chlorophyll-. a concentrations than the coastal areas, including at the lumps. These environmental characters, related to the nutrient rich sub-Antarctic water, appear to have a strong influence on fish distributions in 2005/2006, and may occur generally during La Niña events. Interannual fluctuations in habitat utilization will influence detection of fish in recruitment monitoring surveys and thus bias the resulting juvenile abundance indices. © 2010 Blackwell Publishing Ltd.",Article,Scopus,0.630135129,NA,NA,NA,NA,NA,,,60,NA
102,2-s2.0-84856355168,100,100,"Taki K., Kiyota M., Ichii T., Iwami T.",22636323700;11141639400;54929909700;7004403663;,"Distribution and population structure of Dissostichus eleginoides and D. mawsoni on BANZARE Bank (CCAMLR division 58.4.3b), Indian Ocean",2011,CCAMLR Science,NA,https://www.scopus.com/inward/record.uri?eid=2-s2.0-84856355168&partnerID=40&md5=98637a301b428a7e81f2b8ec82013311,"The distribution, size composition, sex ratio and sexual maturity of Dissostichus eleginoides and D. mawsoni from BANZARE Bank were investigated using biological data collected by a Japanese commercial fishing vessel during the austral summer fishing seasons (December-February) from 2006/07 to 2008/09. Dissostichus eleginoides was mainly caught on shallower banks (<1 000 m), while D. mawsoni was caught on deeper slopes (>1 500 m). Separation of the two species by depth may be related to physical intolerance to cooler temperatures because of the lack of antifreeze in the former species. Dissostichus eleginoides showed a resting stage in sexual maturity, while D. mawsoni was in developing condition. In D. mawsoni, small fish contributed a very low proportion to abundance, suggesting that no substantial recruitment takes place on BANZARE Bank and the populations consist primarily of adults migrating from adjacent Antarctic coastal areas. The life cycle of D. mawsoni on BANZARE Bank is similar to that hypothesised for the Ross Sea population with analogous latitudinal patterns in sexual maturity and size composition. The study indicates that the management of Dissostichus spp. on BANZARE Bank and adjacent waters needs to consider species-specific distribution and possible migration.",Note,Scopus,0.629387858,NA,NA,NA,NA,NA,,,101,NA
137,2-s2.0-84928966778,61,61,"Söffker M., Trathan P., Clark J., Collins M.A., Belchier M., Scott R.",36129874300;7003343692;9432875500;7404083794;6603317757;55224460400;,The impact of predation by marine mammals on Patagonian toothfish longline fisheries,2015,PLoS ONE,10.1371/journal.pone.0118113,https://www.scopus.com/inward/record.uri?eid=2-s2.0-84928966778&doi=10.1371%2fjournal.pone.0118113&partnerID=40&md5=a16a474df7a44004cdf4e05bc5575e07,"Predatory interaction of marine mammals with longline fisheries is observed globally, leading to partial or complete loss of the catch and in some parts of the world to considerable financial loss. Depredation can also create additional unrecorded fishing mortality of a stock and has the potential to introduce bias to stock assessments. Here we aim to characterise depredation in the Patagonian toothfish (Dissostichus eleginoides) fishery around South Georgia focusing on the spatio-temporal component of these interactions. Antarctic fur seals (Arctocephalus gazella), sperm whales (Physeter macrocephalus), and orcas (Orcinus orca ) frequently feed on fish hooked on longlines around South Georgia. A third of longlines encounter sperm whales, but loss of catch due to sperm whales is insignificant when compared to that due to orcas, which interact with only 5% of longlines but can take more than half of the catch in some cases. Orca depredation around South Georgia is spatially limited and focused in areas of putative migration routes, and the impact is compounded as a result of the fishery also concentrating in those areas at those times. Understanding the seasonal behaviour of orcas and the spatial and temporal distribution of ""depredation hot spots"" can reduce marine mammal interactions, will improve assessment and management of the stock and contribute to increased operational efficiency of the fishery. Such information is valuable in the effort to resolve the human-mammal conflict for resources. © 2015 Söffker et al.",Article,Scopus,0.628680309,NA,NA,NA,NA,NA,,,62,NA
157,2-s2.0-84976400534,33,33,"Cleary A.C., Durbin E.G., Casas M.C., Zhou M.",55241522400;7004197809;7101965093;57202997717;,Winter distribution and size structure of Antarctic krill Euphausia superba populations in-shore along the West Antarctic Peninsula,2016,Marine Ecology Progress Series,10.3354/meps11772,https://www.scopus.com/inward/record.uri?eid=2-s2.0-84976400534&doi=10.3354%2fmeps11772&partnerID=40&md5=063103496d64e24430b8116f8ff82d95,"Antarctic krill Euphausia superba are a key component of food webs in the maritime West Antarctic Peninsula, and their life history is tied to the seasonal cycles of sea ice and primary production in the region. Previous work has shown a general in-shore migration of krill in winter in this region; however, the very near-shore has not often been sampled as part of these surveys. We investigated distribution, abundance, and size structure of krill in 3 fjordic bays along the peninsula, and in the adjacent Gerlache Strait area using vertically stratified MOCNESS net tows and ADCP acoustic biomass estimates. Krill abundance was high within bays, with net estimated densities exceeding 60 krill m-3, while acoustic estimates were an order of magnitude higher. Krill within bays were larger than krill in the Gerlache Strait. Within bays, krill aggregations were observed near the seafloor during the day with aggregations extending to the sediment interface, and exhibited diel vertical migration higher into the water column at night. We suggest these high winter krill abundances within fjords are indicative of an active seasonal migration by krill in the peninsula region. Potential drivers for such a migration include reduced advective losses and costs, and availability of sediment food resources within fjords. Seasonally near-shore krill may also affect stock and recruitment assessments and may have implications for managing the krill fishery in this area. © 2016 Inter-Research.",Article,Scopus,0.627041873,0,NA,NA,15,NA,0,15,34,NA
55,2-s2.0-38349069748,38,38,"Ashford J.R., Jones C.M., Hofmann E.E., Everson I., Moreno C.A., Duhamel G., Williams R.",7004993798;7408261454;7102346496;7004076172;7202594229;7102858141;56140901600;,Otolith chemistry indicates population structuring by the Antarctic Circumpolar Current,2008,Canadian Journal of Fisheries and Aquatic Sciences,10.1139/F07-158,https://www.scopus.com/inward/record.uri?eid=2-s2.0-38349069748&doi=10.1139%2fF07-158&partnerID=40&md5=0f9d25b89fc7182869a5b8a02dd19bb8,"Large-scale transport of seawater in ocean currents may generate spatially complex population structure through the advection of life stages of marine fish species. To test this, we compared the chemistry of otolith nuclei from Patagonian toothfish (Dissostichus eleginoides), presently managed as spatially discrete populations corresponding to fishing management areas along the Antarctic Circumpolar Current (ACC), which transports water eastward around the Southern Ocean. The chemistry of otolith nuclei, laid down during early life, differed significantly between fishing areas off South America and the Antarctic and between some Antarctic areas. However, we found significant discrepancies from expectation for a population structure corresponding to fishing areas. We also found evidence of four groups of fish with different early life chemistry: one associated with South America and three Antarctic groups showing mixing consistent with advective transport along the ACC. These results suggest that toothfish populations are structured by their physical environment; population abundance and persistence may rely on a restricted number of breeding members with access to spawning grounds, whereas fisheries may rely substantially on nonbreeding vagrants transported from fishing areas upstream. © 2008 NRC.",Article,Scopus,0.625724543,NA,NA,NA,NA,NA,,,39,NA
104,2-s2.0-84859784685,42,42,"Arkhipkin A., Brickle P., Laptikhovsky V., Pompert J., Winter A.",7005344316;6602972233;7003430203;6507159484;7202642852;,"Skate assemblage on the eastern Patagonian Shelf and Slope: Structure, diversity and abundance",2012,Journal of Fish Biology,10.1111/j.1095-8649.2012.03260.x,https://www.scopus.com/inward/record.uri?eid=2-s2.0-84859784685&doi=10.1111%2fj.1095-8649.2012.03260.x&partnerID=40&md5=864bc50dfbd3dcb6e11e8a37a8fc39e7,"The eastern Patagonian Shelf and continental slope of the south-west Atlantic Ocean support a high biodiversity and abundance of skates. In this study, meso-scale differences in the assemblages, spatial and seasonal distributions of skates are revealed among six habitat zones of the eastern Patagonian Shelf characterized by distinctive oceanographic conditions. Most skates belonged to temperate fauna, and their abundance was much greater in habitats occupied by temperate waters (north-western outer shelf) or mixed waters (northern slope) than in habitats occupied by sub-Antarctic waters (SASW) (south-eastern outer shelf and southern slope). Sub-Antarctic skates were not abundant on the shelf even in habitats occupied by SASW, occurring mainly in deep areas of the lower continental slope. The majority of temperate skates migrated seasonally, shifting northward in winter and spreading southward with warming waters in summer. Most temperate species had two peaks in female maturity (mainly spring and autumn) and spawned in the same habitats where they fed. It is hypothesized that the high biodiversity and abundance of skates on the Patagonian Shelf and Slope are due to the practical absence of their natural competitors, flatfishes, which occupy similar eco-niches elsewhere. © 2012 The Authors. Journal of Fish Biology © 2012 The Fisheries Society of the British Isles.",Article,Scopus,0.625284733,NA,NA,NA,NA,NA,,,43,NA
80,2-s2.0-77955551859,120,120,"Hofmeyr G.J.G., Bester M.N., Kirkman S.P., Lydersen C., Kovacs K.M.",15765167800;7005684769;7003751787;7006299804;7401481138;,"Intraspecific differences in the diet of Antarctic fur seals at Nyrøysa, Bouvetøya",2010,Polar Biology,10.1007/s00300-010-0805-0,https://www.scopus.com/inward/record.uri?eid=2-s2.0-77955551859&doi=10.1007%2fs00300-010-0805-0&partnerID=40&md5=32f8997d5f7dd7cb79e48db853e860a7,"Intraspecific differences in the diets of many species of pinnipeds are to be expected in view of the great differences in morphology, life history and foraging behaviour between the sexes of many species. We examined the diet of the Antarctic fur seal population at Bouvetøya, Southern Ocean, to assess intersexual differences. This was made possible by the analysis of prey remains extracted from scats and regurgitations collected in areas used primarily by one or the other sex. The results indicate that both males and females feed primarily on Antarctic krill Euphausia superba with several species of fish and squid being taken, likely opportunistically given their prevalence. Significant differences were identified in the frequency of occurrence of otoliths in scats and the percentage numerical abundance of the major fish prey species in the diet. Adult males ate a smaller quantity of fish overall, but ate significantly more of the larger fish species. The greater diving capabilities of males and the fact that they are not limited in the extent of their foraging area by having to return regularly to feed dependant offspring may play a role in the differences found between the diets of males and females. Additionally, females might be more selective, favouring myctophids because they are richer in energy than krill. The absence of major differences in the diet between the sexes at this location is likely due to the high overall abundance of prey at Bouvetøya. © 2010 Springer-Verlag.",Article,Scopus,0.624828357,NA,NA,NA,NA,NA,,,121,NA
