,EID,X__1,Authors,Author(s) ID,Title,Year,Source title,DOI,Link,Abstract,Document Type,Access Type,Source,p,Relevance_std,Relevance_ranked,X__2,Timespan_std,Timespan_ranked,Scopus_index,Present_in_training_docs
48,2-s2.0-40149086967,21,Bentley J.M.,23018074800;,"Role of movement, interremnant dispersal and edge effects in determining sensitivity to habitat fragmentation in two forest-dependent rodents",2008,Austral Ecology,10.1111/j.1442-9993.2007.01806.x,https://www.scopus.com/inward/record.uri?eid=2-s2.0-40149086967&doi=10.1111%2fj.1442-9993.2007.01806.x&partnerID=40&md5=26c96f3933410713f27300b5f61d022c,"Habitat fragmentation and disturbance affect patterns of habitat use, animal movement and spatial behaviour and might have significant effects upon population dynamics and trends, and ultimately population persistence. Previous studies have suggested that the ability to disperse between remnants and a positive or neutral response to edges should be associated with species capable of persisting in remnant habitat. Using both radiotracking and trapping data, movement patterns, dispersal and response to habitat edges of Rattus fuscipes were examined within forests, corridors, remnants and pastures in south-east Queensland, Australia. Rattus fuscipes has previously been shown to be robust to the effects of habitat fragmentation; however, contrary to expectations, R. fuscipes was found to be sensitive to edges, and no evidence of interremnant dispersal was detected, despite interremnant distances that were substantially smaller than the distances R. fuscipes was found to move in continuous habitat. Using only trapping data, the same factors were examined in relation to Melomys cervinipes, a species sensitive to fragmentation. Melomys cervinipes was found to utilize edge habitat, but no evidence of interremnant dispersal was detected, although the capacity to detect such movement was limited by low abundance in remnants where M. cervinipes was extant, and the species absence from many remnants. Movement patterns, interremnant dispersal capacity, and sensitivity to edges did not prove to be good predictors of these species responses to habitat fragmentation. Alternative explanations, such as population fluctuation and the capacity for rapid population growth in remnants for these two species, and the influence habitat quality has on these parameters should be investigated. © 2008 Ecological Society of Australia.",Article,NA,Scopus,0.581080965,NA,NA,NA,NA,NA,22,NA
46,2-s2.0-38949157734,22,"Norbury G., Heyward R.",6603960402;6508145389;,Predictors of clutch predation of a globally significant avifauna in New Zealand's braided river ecosystems,2008,Animal Conservation,10.1111/j.1469-1795.2007.00142.x,https://www.scopus.com/inward/record.uri?eid=2-s2.0-38949157734&doi=10.1111%2fj.1469-1795.2007.00142.x&partnerID=40&md5=5287af7fd1c937ad3191fd1b1059b05f,"Predation by introduced mammals is decimating New Zealand's indigenous fauna. Understanding factors that influence this process allows resources for predator control to be applied with maximum effect. This study examines how predation of a secondary prey species (a relatively common but declining native plover, the banded dotterel Charadrius bicinctus) varied with reductions in abundance of a major prey source (rabbits), kill-trapping of predators, nest density and habitat complexity. Banded dotterels mostly nest in open braided riverbeds alongside a number of endemic threatened species. We measured the fate of 753 dotterel clutches exposed to predation by cats, ferrets and hedgehogs. We found key times and places of high predation risk. Immediately after widespread reduction in rabbit populations by rabbit haemorrhagic disease (RHD), clutch predation rates were almost as high (mean, 50%) as those recorded during past rabbit poisoning programmes (mean, 57%). Both rates were significantly higher than the mean predation rate of 22% without rabbit control, suggesting a shift in predator diet immediately after rabbit population declines. Unlike after rabbit poisoning, clutch predation rate remained high in the years after RHD. Other patterns observed included higher clutch predation rate where nest density was lower, suggesting that predation can potentially cause local extinction. Clutch predation was also higher along riverbed margins where vegetation was dense. There was equivocal evidence for an effect of predator kill-trapping on clutch predation rate. Management strategies that could potentially reduce clutch predation risks include focusing predator mitigation measures during periods of rabbit decline, maintaining them for more than one breeding season if the rabbit declines are widespread (e.g. RHD epidemics), and applying greater effort at sites with relatively low nest density and along riverbed margins where predator use is more frequent. © Journal compilation © 2007 The Zoological Society of London.",Article,NA,Scopus,0.73623222,NA,0,NA,NA,15,23,NA
56,2-s2.0-46149083279,23,Abbott I.,7004506235;,Historical perspectives of the ecology of some conspicuous vertebrate species in south-west Western Australia,2008,Conservation Science Western Australia,NA,https://www.scopus.com/inward/record.uri?eid=2-s2.0-46149083279&partnerID=40&md5=ff72855d452e7c1b9488f35844f0fc28,"This paper, an integration of history, ecology and zoogeography, is based on a comprehensive search for firsthand (eyewitness) information from navigators' and explorers' journals (1658-1875), colonists' accounts (1829-1889) and later settlers' records and oldtimers' recollections (1890-2006). Pertinent data for 37 conspicuous vertebrate species (10 bird, 26 mammal and 1 snake species) were collated, analysed, and integrated with more recent scientific information. Much of the information discovered in colonial records and obtained from interviews with oldtimers has been neglected by zoologists and ecologists. The original distributional limits of many of the species studied were thus clarified and redetermined. Detailed information is also provided on the history of the introduction of 14 mammal species into south-west WA, in order to assess their potential contribution to the extinction of native vertebrate species. The introduction, spread and density in bushland of commensal and livestock species does not correlate with the chronology of declines of native species. Changes in geographical distrbution of species were assessed against an interpretive framework of 29 factors, and based on this analysis, a conceptual model (termed the 'fusion' model) of mammal declines and extinctions in south-west and adjacent parts of WA since European settlement is proposed. The reconstructed sequence of events commenced in the 1880s, with declines being caused by disease (10 species estimated to have become totally extinct in WA and 8 species abruptly reduced in abundance and distribution). Another 12 species subsequently reached near-extinction status, following establishment of the fox in the 1920s. Trapping of some species for their fur and accidental poisoning by rabbit baits contributed to local extinctions but were not finally decisive factors. The conceptual framework adopted, based on detailed examination of the information discovered, recognizes three tiers of relevant factors. Only one or two main factors operate at one time, with some of the remaining factors acting in a subsidiary way, and sometimes concurrently or sequentially. Dominant factors are not necessarily the same for each species. Factors usually affected species adversely. South-west WA, despite being settled by Europeans earlier than most other parts of Australia, experienced a stagnant economy, slow population growth and hence minimal clearance of the original vegetation until the 1890s. The anthropogenic factors identified as significant in the decline and depletion of the native fauna, together with an understanding of their correct sequence of operation, provide a historically appropriate conceptual model that may be applicable elsewhere in Australia. The baseline data and historical accounts provide a resource for specialists working on particular species, and include much new material relating to the pelt industry and pest control activities. © The Government of Western Australia, 2008.",Article,NA,Scopus,0.617665422,NA,NA,NA,NA,NA,24,NA
45,2-s2.0-38649143129,24,"Wilson D.J., Mulvey R.L., Clark R.D.",7410086322;24463419100;55473912600;,Sampling skinks and geckos in artificial cover objects in a dry mixed grassland-shrubland with mammalian predator control,2007,New Zealand Journal of Ecology,NA,https://www.scopus.com/inward/record.uri?eid=2-s2.0-38649143129&partnerID=40&md5=6e7a0bc4fb5f9e83091face00960105c,"Introduced mammalian predators threaten populations ofendemicNew Zealand lizards but their effects on lizard populations have not been quantified on the mainland. We trialled the use of artificial cover objects (ACOs) for sampling small terrestrial lizards (the skinks Ofigosoma maccanni, o. nigriplantare polychroma and o. inconspicuum, and gecko Hoplodactylus maculatus) in three experimental mammal-management treatments: a mammal-proof fence, two sites in an intensive mammal-removal area, and an experimental control site with no mammal removal. These predator control regimes were established in 2005-2006 to protect endangered grand skinks (O. grande) and Otago skinks (O. otagense) at Macraes Flat, North Otago. We (1) counted skinks and geckos found under ACOs on a single day and compared these counts between treatments, and (2) estimated lizard population sizes (N) based on capture-mark-recapture (CNM) of lizards under ACOs in daily and weekly sampling sessions. Our results provide baseline data of the abundance of the small lizard species shortly after implementation of predator management. Single-day counts of skinks were significantly higher inside the mammal fence compared with the experimental control. No consistent differences were found between the other treatments. Significantly more skinks were counted in gully habitats than in ridge habitats. N, counts of skinks from the first day of CMR, and the total number of individuals caught were correlated, but these relationships must be validated with independent data. Few geckos were caught unless ACOs were placed near rock outcrops. Only two skinks but 25% of geckos moved between adjacent ACOs (5-m spacing). The recapture rate of skinks was low; captures declined when ACOs were checked daily but not when they were.checked weekly. Because of potential biases of these methods, we propose to compare counts in ACOs and N based on CMR in ACOs with N based on CNM in pitfall traps with 3-m spacing. © New Zealand Ecological Society.",Article,NA,Scopus,0.658118258,NA,NA,NA,NA,NA,25,NA
42,2-s2.0-34548565636,25,"Wirsing A.J., Heithaus M.R., Dill L.M.",6602170672;6701572403;7006364690;,Fear factor: Do dugongs (Dugong dugon) trade food for safety from tiger sharks (Galeocerdo cuvier)?,2007,Oecologia,10.1007/s00442-007-0802-3,https://www.scopus.com/inward/record.uri?eid=2-s2.0-34548565636&doi=10.1007%2fs00442-007-0802-3&partnerID=40&md5=8dd9e336317453b169cd409d819c6979,"Predators can influence plants indirectly by altering spatial patterns of herbivory, so studies assessing the relationship between perceived predation risk and habitat use by herbivores may improve our understanding of community organization. In marine systems, the effects of predation danger on space use by large herbivores have received little attention, despite the possibility that predator-mediated alterations in patterns of grazing by these animals influence benthic community structure. We evaluated the relationship between habitat use by foraging dugongs (Dugong dugon) and the threat of tiger shark predation in an Australian embayment (Shark Bay) between 1997 and 2004. Dugong densities were quantified in shallow (putatively dangerous) and deep (putatively safe) habitats (seven survey zones allocated to each habitat), and predation hazard was indexed using catch rates of tiger sharks (Galeocerdo cuvier); seagrass volume provided a measure of food biomass within each zone. Overall, dugongs selected shallow habitats, where their food is concentrated. Foragers used shallow and deep habitats in proportion to food availability (input matching) when large tiger sharks were scarce and overused deep habitats when sharks were common. Furthermore, strong synchrony existed between daily measures of shark abundance and the extent to which deep habitats were overused. Thus, dugongs appear to adaptively manage their risk of death by allocating time to safe but impoverished foraging patches in proportion to the likelihood of encountering predators in profitable but more dangerous areas. This apparent food-safety trade-off has important implications for seagrass community structure in Shark Bay, as it may result in marked temporal variability in grazing pressure. © 2007 Springer-Verlag.",Article,NA,Scopus,0.522858779,NA,NA,NA,NA,NA,26,NA
41,2-s2.0-34548490948,26,"Soderquist T., Gibbons D.",6603097693;21233451600;,Home-range of the Powerful Owl (Ninox strenua) in dry sclerophyll forest,2007,Emu,10.1071/MU06055,https://www.scopus.com/inward/record.uri?eid=2-s2.0-34548490948&doi=10.1071%2fMU06055&partnerID=40&md5=358fe9bb08b8844d925d44d99321e725,"Since European settlement of Australia, the dry open forests and woodlands of central Victoria have been extensively cleared and most large trees harvested, resulting in a decline of arboreal mammal populations. The Powerful Owl, which was formerly reliant on these prey species, still persists in the region but at very low densities and uncertain viability. Previous research has shown that Powerful Owls select home-ranges with more large trees and hollows than the forest at large, but the amount of such habitat that is required remained undefined. Four adult Powerful Owls (two males and two females) from four pairs occupying geographically separate territories in box-ironbark forest were radio-tracked over 1-6 months. Home-range size was much greater than previously assumed for this species (minimum convex polygon of 4774, 2896, 1770 and 1382 ha). Range-length was 5.7-8.9 km, and on average 5-12% of each home-range was used during a single night. Core foraging areas comprised many, typically small, patches scattered across the entire home-range. Selection of roosting sites was flexible and did not constrain spatial use of home-range, with 96% of roosts in very small to medium-sized trees, which are widely distributed. The finding of unexpectedly large foraging ranges suggests that enhancement of habitat quality and mammalian prey abundance in currently occupied home-ranges is the foremost goal for forest managers if a viable population is to be sustained. © Royal Australasian Ornithologists Union 2007.",Article,NA,Scopus,0.689892986,NA,NA,NA,NA,NA,27,NA
40,2-s2.0-34548414173,27,"Dawson J.P., Claridge A.W., Triggs B., Paull D.J.",56209429600;6701688847;7004489309;7004331155;,"Diet of a native carnivore, the spotted-tailed quoll (Dasyurus maculatus), before and after an intense wildfire",2007,Wildlife Research,10.1071/WR05101,https://www.scopus.com/inward/record.uri?eid=2-s2.0-34548414173&doi=10.1071%2fWR05101&partnerID=40&md5=7bae96221991834f4eca4a2ce2b6befe,"The relationship between the diet of the spotted-tailed quoll (Dasyurus maculatus) and the abundance of its prey was investigated in rain-shadow woodland habitat in southern New South Wales for one year before and two years after a high-intensity, broad-scale wildfire. Scats were variously collected from quoll latrines and live-trapped animals during winter for each of the three years and analysed to determine prey items. Estimates of abundance of key ground-dwelling and arboreal medium-sized mammals were simultaneously obtained using plot-based survey techniques and spotlighting. Over the duration of the study, quoll diet was dominated by medium-sized mammals, particularly brushtail possums (Trichosurus spp.) and lagomorphs (rabbit and hare), followed by small and large-sized mammals. After the fire there was a shift in utilisation of food resources in response to significant changes in prey availability. Monitoring revealed that brushtail possums, lagomorphs and bandicoots were all significantly less abundant in the winter following the fire, and populations of lagomorphs, but not possums, then increased in the second winter after the fire. Quolls adapted to this by taking significantly more lagomorphs in each of the two years after the fire and by taking advantage of a short-term increase in the availability of carrion. The results of this study reaffirm that the spotted-tailed quoll is adaptable in its utilisation of available food, and that fires are not necessarily detrimental to the species and its prey base. © CSIRO 2007.",Article,NA,Scopus,0.70287297,NA,NA,NA,NA,NA,28,NA
57,2-s2.0-48249140174,28,"Hoare J.M., Adams L.K., Bull L.S., Towns D.R.",14060174600;24480486200;12647183100;6603727004;,Attempting to manage complex predator-prey interactions fails to avert imminent extinction of a threatened New Zealand skink population,2007,Journal of Wildlife Management,10.2193/2006-488,https://www.scopus.com/inward/record.uri?eid=2-s2.0-48249140174&doi=10.2193%2f2006-488&partnerID=40&md5=69ac652b50d4151992eb4eac58562468,"The current primary threats to biodiversity on a global scale are species invasions and habitat modification. Management of vulnerable populations often involves a lengthy sequence of 1) research to identify threats and recommend management strategies, 2) active management, and 3) results monitoring to assess effectiveness of management. The last mainland population of the large, endemic New Zealand skink (Whitaker's skink [Cyclodina whitakeri]) provides an opportunity to test this process in a system where the synergistic effects between invasive species (introduced rodents and grasses) have predicted outcomes. A low abundance of Whitaker's skink at the Pukerua Bay Scientific Reserve in the 1980s prompted management recommendations to remove grazing stock and revegetate the site to simultaneously restore habitat and provide protection against introduced mammalian predators. Since Whitaker's skink have low detectability, it was recommended that sympatric copper skink (C. aenea) be used an indicator species of management effectiveness. Grazing stock were removed in 1987, but efforts to revegetate the site were ineffective. Long-term monitoring (1984-2006) of the Whitaker's skink population and 4 other sympatric lizard species within a 336-m area at the site resulted in 1,693 lizard captures over 7,597 trap days. Whitaker's skink represented 2.8% of all captures in 1984-1988, but declined relative to other species to represent only 0.2% of captures in 2000-2006 (representing 2 individuals). Congeneric copper skink showed a similar decline with capture rates also approaching zero by 2006. Removing grazing stock did not result in an increased abundance of Whitaker's skink or copper skink through improved habitat quality, as was intended by the management recommendation. Instead, reduced grazing has allowed introduced seeding grasses to proliferate, which may have led to periodic rodent irruptions, supporting a guild of introduced mammalian predators and depleting populations of Whitaker's skink and copper skink. In this instance, attempted protection may have driven a vulnerable population towards extinction. We recommend investigating the feasibility of constructing a mammal-proof fence around the core Whitaker's skink habitat, as the last remaining management option to salvage the population.",Article,NA,Scopus,0.783080545,NA,1,Population trends are discussed but these are in the context of human interventions to aid conservation,NA,10,29,NA
43,2-s2.0-36248949718,29,"De Tores P.J., Hayward M.W., Dillon M.J., Brazell R.I.",6506178990;7102577443;57196693159;23003257900;,"Review of the distribution, causes for the decline and recommendations for management of the quokka, setonix brachyurus (Macropodidae: Marsupialia), an endemic macropolid marsupial from South-West Western Australia",2007,Conservation Science Western Australia,NA,https://www.scopus.com/inward/record.uri?eid=2-s2.0-36248949718&partnerID=40&md5=e91f58db553660d9c640e6facd691493,"The former and current distribution of the quokka, Setonix brachyurus, was mapped from published and all available unpublished records. At the time of European settlement the quokka was widespread and abundant and its distribution encompassed an area of approximately 41 200 km2 of south-west Western Australia inclusive of two offshore islands, Bald Island and Rottnest Island. Historical reports indicated an extensive population decline occurred in the 1930s. The decline continued, with a previously undocumented decline apparent in the period from 1980 to 1992. However, this decline may be an artefact of the time scales used for mapping and may well equate with a previously reported decline for a suite of south-west mammals in the 1970s. By 1992 the quokka's distribution had been reduced to an area of approximately 17 800 km2. An increased awareness of the presence of the quokka on the mainland has resulted in numerous rcportings of quokka presence since 1992, has confirmed the existence of several populations at the northern extent of the quokka's known geographic range and indicated the current, 2005, distribution to be similar to that in 1992. However, survey and population estimates at six of these mainland locations from the northern jarrah forest indicated low abundance. There have been no population estimates elsewhere on the mainland. Two populations have been reported from the Swan Coastal Plain, but neither has been confirmed extant. Predation by the introduced fox, Vulpes vulpes, is implicated as a major cause of the quokka's initial decline, while ongoing predation, habitat destruction and modification through altered fire regimes have contributed to the continued decline. Specific conservation management actions are recommended, namely: (i) Implementing an active adaptive management program in the northern jarrah forest to determine quokka population response to habitat manipulation through the use of fire, fox baiting and pig control; (ii) Surveying the Stirling Range and Green Range populations with emphasis placed on determining population size and population genetic structure; (iii) Surveying the reported occurrences from the Swan Coastal Plain, with emphasis on unambiguously determining presence. If confirmed, priority should be directed to assessing population size and determining the management requirements to ensure persistence of the population; (iv) Surveying southern forest and south coast populations to assess quokka population size, the extent of movement between subpopulations and assessment of the range of habitat types used by quokkas. The latter should be combined with spatial analyses of known extant populations and suitable and potentially suitable habitat; (v) Determining the role of fire in establishing and maintaining preferred habitat of southern forest and south coast populations; and (vi) Establishing a program to assess the potential effects from management operations.",Review,NA,Scopus,0.898420484,NA,1,Historical records used,NA,5,30,NA
38,2-s2.0-33847366669,30,"Jacob J., Hinds L.A., Singleton G.R., Sutherland D.R., Ylönen H.",56962770000;7007092676;7004925104;7401515262;7004389247;,Is the reproductive potential of wild house mice regulated by extrinsic or intrinsic factors?,2007,Austral Ecology,10.1111/j.1442-9993.2007.01680.x,https://www.scopus.com/inward/record.uri?eid=2-s2.0-33847366669&doi=10.1111%2fj.1442-9993.2007.01680.x&partnerID=40&md5=d9e11ae9b226044fb5f8335e4f87219c,"The regulation of reproductive performance in small mammals may be determined by extrinsic or intrinsic parameters. In a large-scale, replicated field experiment we monitored the seasonal fluctuation in food availability and tested the effects of food addition on the reproductive performance of wild house mice (Mus domesticus) in south-eastern Australia. Ovulation rates and litter size increased during spring and peaked in October/November. Ovulation rate was consistently higher than litter size by approximately 1.2 embryos (19%). None of the extrinsic parameters measured (food quality and quantity, mouse abundance) had an impact on reproductive performance. The addition of food did not prevent the mid summer decrease in ovulation rates nor did it alter the difference between ovulation rates and litter size. While the number of previous pregnancies did not affect reproductive performance, the age of mice did: older mice tended to have higher ovulation rates than younger mice. The effect of age-dependent changes in ovulation rates on population growth rates of house mice seemed to be of limited importance. We conclude that the reproductive output in wild house mice is determined by ovulation rates and not by litter size. The regulation of ovulation rates through an intrinsic factor (age) seems evident but the importance of food availability and house mouse abundance for ovulation rates is low. © 2007 Ecological Society of Australia.",Article,NA,Scopus,0.609892371,NA,NA,NA,NA,NA,31,NA
